#,question,a,b,c,d,correct_answer,category
38,"Κατά την προετοιμασία των προτάσεων οδηγιών, σημαντικό ρόλο παίζει/ουν:",Η Επιτροπή Μονίμων Αντιπροσώπων (Coreper),Οι φορείς εκπροσώπησης συμφερόντων και οι εμπειρογνώμονες,Το Ευρωπαϊκό Κοινοβούλιο,Τα ευρωπαϊκά πολιτικά κόμματα,1,Ευρωπαϊκοί Θεσμοί και Δίκαιο
39,Ο Ευρωπαίος Διαμεσολαβητής είναι αρμόδιος να δέχεται καταγγελίες σχετικές με κρούσματα κακής διοίκησης στο πλαίσιο της δράσης:,"Των οργάνων ή των οργανισμών της Ένωσης, καθώς και των εθνικών αρχών",Των εθνικών αρχών με την εξαίρεση των εθνικών δικαστηρίων κατά την άσκηση δικαιοδοτικού τους έργου,"Των οργάνων ή των οργανισμών της Ένωσης, με την εξαίρεση του Δικαστηρίου της Ευρωπαϊκής Ένωσης κατά την άσκηση του δικαιοδοτικού του έργου","Του Ευρωπαϊκού Κοινοβουλίου, του Συμβουλίου και της Επιτροπής",2,Ευρωπαϊκοί Θεσμοί και Δίκαιο
40,"Ποιος είναι, σύμφωνα με τη Συνθήκη για τη Λειτουργία της Ευρωπαϊκής Ένωσης, ο πρωταρχικός στόχος του Ευρωπαϊκού Συστήματος Κεντρικών Τραπεζών;",Η διατήρηση της σταθερότητας των τιμών,Η στήριξη των γενικών οικονομικών πολιτικών της Ευρωπαϊκής Ένωσης,Η προληπτική εποπτεία του τραπεζικού συστήματος κάθε κράτους-μέλους,Η σταθερότητα του χρηματοπιστωτικού συστήματος,0,Ευρωπαϊκοί Θεσμοί και Δίκαιο
41,Η δημοσιονομική πολιτική των χωρών της ζώνης του ευρώ:,Αποφασίζεται από κοινού στο Eurogroup,Αποτελεί αντικείμενο πολυμερούς εποπτείας από το Συμβούλιο,Εγκρίνεται από την Ευρωπαϊκή Επιτροπή,Οφείλει να λαμβάνει υπ’ όψιν τις υποδείξεις της Ευρωπαϊκής Κεντρικής Τράπεζας,1,Ευρωπαϊκοί Θεσμοί και Δίκαιο
42,Ποια είναι η βασική αποστολή της Ευρωπαϊκής Τράπεζας Επενδύσεων;,Η χρηματοδότηση σχεδίων που συμβάλλουν στην επίτευξη των στόχων της Ευρωπαϊκής Ένωσης,"Η προσέλκυση επενδυτών από τρίτες, εκτός Ευρωπαϊκής Ένωσης, χώρες","Η διευκόλυνση των επενδύσεων τόσο εντός όσο και εκτός Ευρωπαϊκής Ένωσης στους τομείς της έρευνας, της τεχνολογικής ανάπτυξης και του διαστήματος","Η διευκόλυνση των επενδύσεων σε τρίτες, εκτός Ευρωπαϊκής Ένωσης, χώρες",0,Ευρωπαϊκοί Θεσμοί και Δίκαιο
43,Η Ευρωπαϊκή Υπηρεσία Καταπολέμησης της Απάτης είναι αρμόδια να διερευνά:,Περιπτώσεις σοβαρής απάτης εις βάρος αξιωματούχων και υπαλλήλων της Ευρωπαϊκής Ένωσης,"Περιπτώσεις απάτης εις βάρος του προϋπολογισμού της Ευρωπαϊκής Ένωσης, διαφθοράς και σοβαρών παραπτωμάτων στα όργανα της Ευρωπαϊκής Ένωσης",Περιπτώσεις διαφθοράς και σοβαρών παραπτωμάτων μόνο στην Ευρωπαϊκή Επιτροπή και το Ευρωπαϊκό Κοινοβούλιο,Περιπτώσεις κατάχρησης από τοπικούς αποδέκτες της ανθρωπιστικής βοήθειας που η Ευρωπαϊκή Ένωση χορηγεί σε τρίτες χώρες,1,Ευρωπαϊκοί Θεσμοί και Δίκαιο
44,"Σε περίπτωση παραβάσεως ενωσιακού κανόνα από κράτος μέλος, ο θιγόμενος ιδιώτης:",Μπορεί να στραφεί κατά του κράτους μέλους – παραβάτη ενώπιον του Δικαστηρίου της Ευρωπαϊκής Ένωσης,Μπορεί να προσφύγει στον Ευρωπαίο Διαμεσολαβητή.,Μπορεί να στραφεί κατά του κράτους μέλους – παραβάτη ενώπιον των εθνικών δικαστηρίων του τελευταίου,Μπορεί να στραφεί κατά του κράτους μέλους – παραβάτη ενώπιον του Διεθνούς Δικαστηρίου της Χάγης,2,Ευρωπαϊκοί Θεσμοί και Δίκαιο
45,"Ένα διοικητικό όργανο που καλείται να εφαρμόσει εθνική διάταξη, η οποία αντίκειται σε διάταξη του ενωσιακού δικαίου:",Υποχρεούται να εφαρμόσει την εθνική διάταξη αφού δεν αποτελεί δικαστική αρχή,Υποχρεούται να ακυρώσει την εθνική διάταξη,"Υποχρεούται να αφήσει ανεφάρμοστη την εθνική διάταξη, η οποία εξακολουθεί να ισχύει",Υποχρεούται να απευθύνει σχετικό ερώτημα στην προϊστάμενη αρχή,2,Ευρωπαϊκοί Θεσμοί και Δίκαιο
46,"Όταν ένας ιδιώτης θεωρεί ότι μια απόφαση που του απευθύνει η Επιτροπή θίγει θεμελιώδη δικαιώματά του, μπορεί:",Να ασκήσει ατομική προσφυγή κατά της Ευρωπαϊκής Ένωσης στο Ευρωπαϊκό Δικαστήριο των Δικαιωμάτων του Ανθρώπου,Να προσφύγει στο Γενικό Δικαστήριο της Ευρωπαϊκής Ένωσης μετά από εξάντληση των εσωτερικών ενδίκων βοηθημάτων,Να προσφύγει απευθείας στο Γενικό Δικαστήριο της Ευρωπαϊκής Ένωσης,Να προσφύγει κατά της Ευρωπαϊκής Ένωσης στα εθνικά του δικαστήρια,2,Ευρωπαϊκοί Θεσμοί και Δίκαιο
47,Η πρακτική των λεγόμενων «τριλόγων»:,"Αφορά άτυπες διαπραγματεύσεις εκπροσώπων του Ευρωπαϊκού Κοινοβουλίου, του Συμβουλίου και της Επιτροπής με στόχο την επίτευξη συμφωνίας στο πλαίσιο της συνήθους νομοθετικής διαδικασίας",Χρησιμοποιείται για την προετοιμασία τροποποιήσεων της Συνθήκης για τη Λειτουργία της Ευρωπαϊκής Ένωσης (ΣΛΕΕ),Χρησιμοποιείται μόνο στο πλαίσιο μιας ειδικής νομοθετικής διαδικασίας,Αποτελεί μέθοδο επιλύσεως διαφορών μεταξύ των θεσμικών οργάνων,0,Ευρωπαϊκοί Θεσμοί και Δίκαιο
48,Η αρχή της αναλογικότητας της Ευρωπαϊκής Ένωσης:,Αφορά το δικαίωμα των κρατών μελών να μην εφαρμόζουν νομικές πράξεις της Ευρωπαϊκής Ένωσης  που τα επιβαρύνουν περισσότερο από άλλα κράτη μέλη,"Υποχρεώνει τα θεσμικά όργανα της Ευρωπαϊκής Ένωσης, όποτε προβαίνουν σε κάποια νομική πράξη, να επιλέγουν τα λιγότερο επαχθή μέσα για την επίτευξη του επιδιωκόμενου σκοπού",Υποχρεώνει την Ευρωπαϊκή Επιτροπή να κατανέμει τους διαθέσιμους πόρους αναλόγως της βαρύτητας των επιδιωκόμενων κάθε φορά στόχων,"Αφορά την υποχρέωση των θεσμικών οργάνων, όταν ασκούν συντρέχουσες αρμοδιότητες της Ευρωπαϊκής Ένωσης, να περιορίζουν τη δράση τους μόνον σε ζητήματα υπερεθνικού ενδιαφέροντος",1,Ευρωπαϊκοί Θεσμοί και Δίκαιο
49,Η αρχή της επικουρικότητας διέπει:,Την κατανομή αρμοδιοτήτων μεταξύ Ευρωπαϊκής Ένωσης και κρατών-μελών,Την άσκηση από την Ευρωπαϊκή Ένωση των αποκλειστικών της αρμοδιοτήτων,Την άσκηση από την Ευρωπαϊκή Ένωση των μη αποκλειστικών της αρμοδιοτήτων,Την άσκηση από τα κράτη-μέλη όσων αρμοδιοτήτων δεν έχουν μεταβιβάσει στην Ευρωπαϊκή Ένωση,2,Ευρωπαϊκοί Θεσμοί και Δίκαιο
50,Η Συνθήκη της Λισσαβόνας αναγνώρισε στην Ευρωπαϊκή Ένωση:,Εδαφική κυριαρχία,Ενιαία νομική προσωπικότητα,Τον χαρακτήρα της ως διεθνούς οργανισμού,Τον χαρακτήρα της ως συνομοσπονδίας κρατών,1,Ευρωπαϊκοί Θεσμοί και Δίκαιο
51,Ποια από τις παρακάτω αρμοδιότητες ΔΕΝ ανήκει στις αρμοδιότητες που διακρίνει η Συνθήκη της Λισαβόνας;,Συντρέχουσες αρμοδιότητες,Συμβουλευτικές αρμοδιότητες,Υποστηρικτικές αρμοδιότητες,Αποκλειστικές αρμοδιότητες,1,Ευρωπαϊκοί Θεσμοί και Δίκαιο
52,Η Συνθήκη για τη Λειτουργία της Ευρωπαϊκής Ένωσης παρέχει τη βάση για τη θέσπιση με τη συνήθη νομοθετική διαδικασία νομοθετικών μέτρων:,Επιβολής διεθνών κυρώσεων (περιοριστικών μέτρων) για την αντιμετώπιση παραβιάσεων του διεθνούς δικαίου,Εναρμόνισης των εθνικών διατάξεων φορολογικού δικαίου,Εναρμόνισης των εθνικών διατάξεων που έχουν ως αντικείμενο την εγκαθίδρυση και λειτουργία της εσωτερικής αγοράς,Εναρμόνισης των εθνικών νομοθεσιών στον τομέα της εθνικής κοινωνικής ασφάλισης και κοινωνικής προστασίας,2,Ευρωπαϊκοί Θεσμοί και Δίκαιο
53,Όταν η Ευρωπαϊκή Ένωση  και τα κράτη μέλη έχουν συντρέχουσα αρμοδιότητα:,Τα κράτη μέλη δικαιούνται να ενεργούν στον βαθμό που η Ευρωπαϊκή Ένωση  δεν έχει ρυθμίσει κάποιο ζήτημα,Η Ευρωπαϊκή Ένωση δικαιούται να ενεργεί στον βαθμό που τα κράτη μέλη δεν έχουν ρυθμίσει κάποιο ζήτημα,Τόσο η Ευρωπαϊκή Ένωση όσο και τα κράτη μέλη μπορούν να ρυθμίζουν αυτονόμως κάποιο ζήτημα,Η Ευρωπαϊκή Ένωση και τα κράτη μέλη μπορούν να ρυθμίσουν μόνον από κοινού κάποιο ζήτημα,0,Ευρωπαϊκοί Θεσμοί και Δίκαιο
54,Η ευρωπαϊκή πρωτοβουλία πολιτών:,Απευθύνεται στο Ευρωπαϊκό Κοινοβούλιο και το Συμβούλιο από τα οποία ζητά να νομοθετήσουν τα προτεινόμενα από αυτήν μέτρα,"Απευθύνεται στα κοινοβούλια των κρατών μελών, τουλάχιστον επτά από τα οποία πρέπει να την υιοθετήσουν με σχετικό ψήφισμα",Πρέπει να υπογράφεται από τουλάχιστον 700.000 κατοίκους των κρατών μελών ασχέτως υπηκοότητας,Πρέπει να υπογράφεται από τουλάχιστον 1.000.000 πολίτες της Ευρωπαϊκής Ένωσης,3,Ευρωπαϊκοί Θεσμοί και Δίκαιο
55,Δικαίωμα πρόσβασης στα έγγραφα των θεσμικών και λοιπών οργάνων και οργανισμών της Ένωσης:,Έχει κάθε πολίτης της Ένωσης καθώς και κάθε φυσικό ή νομικό πρόσωπο που κατοικεί ή έχει την καταστατική έδρα του σε ένα κράτος μέλος,Έχει ο πολίτης της Ένωσης που δικαιολογεί ειδικό έννομο συμφέρον για την πρόσβαση σε συγκεκριμένο έγγραφο,Έχουν όλοι οι πολίτες της Ένωσης και μόνον αυτοί,Έχουν οι πολίτες της Ένωσης που κατοικούν σε κράτος μέλος της ζώνης του Ευρώ Ενότητα: Οικονομικές Επιστήμες,0,Ευρωπαϊκοί Θεσμοί και Δίκαιο
1,Κατά τη διάρκεια της δεκαετίας 1990 οι οικονομίες της Ανατολικής Ευρώπης άλλαξαν από σχεδιαζόμενες οικονομίες σε οικονομίες της αγοράς. Ποια από τις παρακάτω περιπτώσεις θεωρείτε ότι περιγράφει καλύτερα τις αλλαγές οι οποίες έλαβαν χώρα;,Αύξηση του κεντρικού σχεδιασμού για την κατανομή και ανακατανομή των πόρων,Μεγιστοποίηση των παρεμβάσεων για τον προσδιορισμό των τιμών,Αύξηση της εξάρτησης από τον μηχανισμό της αγοράς για την κατανομή και ανακατανομή των μέσων παραγωγής,Αύξηση των πόρων για επιδόματα ανεργίας,2,Οικονομικές Επιστήμες
2,Ποιο από τα παρακάτω χαρακτηρίζει το δυνητικό προϊόν μιας οικονομίας;,Είναι το πραγματικό επίπεδο παραγωγής που παράγεται κάθε έτος,Αντιπροσωπεύει την παραγωγή όταν οι πόροι χρησιμοποιούνται πλήρως και αποτελεσματικά,Είναι το επίπεδο παραγωγής σε συνθήκες υψηλής ανεργίας,Εξαρτάται από τον αριθμό των εργαζομένων στην οικονομία,1,Οικονομικές Επιστήμες
3,Στην Καμπύλη Παραγωγικών Δυνατοτήτων (ΚΠΔ) ποια σημεία αντιστοιχούν στο δυνητικό προϊόν της οικονομίας,"Τα σημεία εκτός, άνω και δεξιά της καμπύλης",Τα σημεία επί της καμπύλης,Τα σημεία εντός της καμπύλης,Κανένα σημείο. Το υπόδειγμα της ΚΠΔ δεν αναφέρεται στο δυνητικό προϊόν της οικονομίας,1,Οικονομικές Επιστήμες
4,Ποιος παράγοντας επηρεάζει το δυνητικό προϊόν μιας οικονομίας;,Οι κυβερνητικές πολιτικές για την κατανομή του πλούτου,Η τεχνολογία και η παραγωγικότητα των πόρων,Οι φόροι επί των εισοδημάτων των νοικοκυριών,Η ποσότητα των εξαγωγών και εισαγωγών μιας χώρας,1,Οικονομικές Επιστήμες
5,"Στο υπόδειγμα του Εισοδηματικού Κυκλώματος που αντιστοιχεί σε μια κλειστή οικονομία χωρίς δημόσιο τομέα, ποια από τις παρακάτω προτάσεις είναι αληθής;",Οι επιχειρήσεις προσφέρουν στα νοικοκυριά μέρος του κεφαλαίου τους,Τα νοικοκυριά προσφέρουν στις επιχειρήσεις παραγωγικούς συντελεστές,Τα νοικοκυριά πληρώνουν στις επιχειρήσεις τόκους ως αμοιβή του κεφαλαίου,Καμία από τις λοιπές απαντήσεις,1,Οικονομικές Επιστήμες
6,Το γνωμικό «δεν υπάρχει δωρεάν γεύμα» αναφέρεται:,Στην ιδεολογία ότι οι φτωχοί είναι υπεύθυνοι για την κατάστασή τους,"Στο γεγονός ότι για να παραχθεί οποιοδήποτε αγαθό, θα πρέπει να θυσιαστεί κάτι άλλο",Στην ιδεολογία ότι η κοινωνική πολιτική πρέπει να περιορίζεται στο ελάχιστο,Σε καμία από τις λοιπές απαντήσεις,1,Οικονομικές Επιστήμες
7,Το «αόρατο χέρι» του Adam Smith (1723-1790) αναφέρεται:,Στις απαραίτητες παρεμβάσεις του κράτους για την παραγωγή των αναγκαίων αγαθών,Στις ανώνυμες αγαθοεργίες για την υποστήριξη των φτωχών,Στην ιδέα ότι η επιδίωξη της μεγιστοποίησης του ατομικού συμφέροντος οδηγεί μέσω του ανταγωνισμού στην μεγιστοποίηση του κοινωνικού,Στην ιδέα ότι η προστασία του περιβάλλοντος οδηγεί στη βιώσιμη ανάπτυξη,2,Οικονομικές Επιστήμες
8,Το περίφημο παράδειγμα της βιοτεχνίας καρφίτσας του Adam Smith (1723-1790) αναφέρεται:,Στην εξειδίκευση και στην αύξηση της παραγωγικότητας της εργασίας,Στην βελτίωση του κεφαλαιουχικού εξοπλισμού της επιχείρησης,Στην αύξηση των εξαγωγών καρφίτσας,Στη δημιουργία συνδικαλιστικού σωματείου εργαζομένων,0,Οικονομικές Επιστήμες
9,"Τι σημαίνει η έννοια ""ελαστικότητα της ζήτησης"";",Η μεταβολή  της τιμής ενός αγαθού όταν μεταβάλλεται η ζητούμενης ποσότητα,Η ευαισθησία της ζητούμενης ποσότητας ως προς μία μεταβολή στην τιμή,Η σχέση μεταξύ προσφοράς και ζήτησης,Η απόσταση μεταξύ της καμπύλης ζήτησης και της καμπύλης προσφοράς,1,Οικονομικές Επιστήμες
10,Εάν η τιμή ενός αγαθού βρίσκεται πάνω από την τιμή ισορροπίας:,Δημιουργείται  πλεόνασμα και η τιμή θα τείνει να αυξηθεί,Δημιουργείται πλεόνασμα και η τιμή θα τείνει να μειωθεί,Δημιουργείται έλλειμμα και η τιμή θα τείνει να αυξηθεί,Δημιουργείται έλλειμμα και η τιμή θα τείνει να μειωθεί,1,Οικονομικές Επιστήμες
11,Μία αύξηση της ζήτησης (μετατόπιση προς τα δεξιά της καμπύλης ζήτησης) ενός αγαθού τείνει να προκαλέσει:,Αύξηση της τιμής και της ποσότητας ισορροπίας,Μείωση της τιμής και της ποσότητας ισορροπίας,Αύξηση της τιμής ισορροπίας και μείωση της ποσότητας ισορροπίας,Μείωση της τιμής ισορροπίας και αύξηση της ποσότητας ισορροπίας,0,Οικονομικές Επιστήμες
12,Εάν η τιμή ενός αγαθού βρίσκεται κάτω από την τιμή ισορροπίας:,Δημιουργείται  πλεόνασμα και η τιμή θα τείνει να αυξηθεί,Δημιουργείται πλεόνασμα και η τιμή θα τείνει να μειωθεί,Δημιουργείται έλλειμμα και η τιμή θα τείνει να αυξηθεί,Δημιουργείται έλλειμμα και η τιμή θα τείνει να μειωθεί,2,Οικονομικές Επιστήμες
13,Εάν τα αγαθά Χ και Ψ είναι συμπληρωματικά τότε:,"Εάν αυξηθεί η τιμή του Χ, η ζητούμενη ποσότητα του Ψ τείνει να αυξηθεί","Εάν αυξηθεί η τιμή του Χ, η ζητούμενη ποσότητα του Ψ τείνει να μειωθεί","Εάν αυξηθεί η τιμή του Χ, η ζητούμενη ποσότητα του Ψ παραμένει ανεπηρέαστη",Όλες οι λοιπές προτάσεις είναι λανθασμένες,1,Οικονομικές Επιστήμες
14,Διαπιστώστε ποια από τις παρακάτω προτάσεις είναι αληθής:,Η τιμή ισορροπίας ενός αγαθού αντιστοιχεί στο μέγιστο κέρδος του παραγωγού,Η τιμή ισορροπίας ενός αγαθού προσδιορίζεται κατά την περίοδο των εκπτώσεων,Η τιμή ισορροπίας ενός αγαθού προσδιορίζεται στην αγορά όταν η ζητούμενη ποσότητα είναι ίση με την προσφερόμενη,Η τιμή ισορροπίας ενός αγαθού προσδιορίζεται μετά την αφαίρεση του ΦΠΑ,2,Οικονομικές Επιστήμες
15,Διαπιστώστε ποια από τις παρακάτω προτάσεις είναι αληθής:,Η εισοδηματική ελαστικότητα ζήτησης είναι ίση με το μηδέν (0) στην περίπτωση ενός κανονικού αγαθού,Η εισοδηματική ελαστικότητα ζήτησης είναι μεγαλύτερη από το μηδέν (0) στην περίπτωση ενός κανονικού αγαθού,Η εισοδηματική ελαστικότητα ζήτησης είναι μικρότερη από το μηδέν (0) στην περίπτωση ενός κανονικού αγαθού,Η εισοδηματική ελαστικότητα ζήτησης είναι μεγαλύτερη από το μηδέν (0) στην περίπτωση ενός κατώτερου αγαθού,1,Οικονομικές Επιστήμες
16,Τι ορίζεται ως «κατώτερο αγαθό»;,Το αγαθό του οποίου η ζητούμενη ποσότητα αυξάνεται όταν μειώνεται η τιμή του,Το αγαθό του οποίου η ζητούμενη ποσότητα μειώνεται όταν αυξάνεται το εισόδημα του καταναλωτή,Το αγαθό η κατανάλωση του οποίου  ζημιώνει την υγεία του καταναλωτή,Το αγαθό το οποίο αποσύρεται από την αγορά ως ακατάλληλο,1,Οικονομικές Επιστήμες
17,Καθαρές εξαγωγές είναι:,Οι εισαγωγές συν τις εξαγωγές,Οι εισαγωγές μείον τις εξαγωγές,Οι εξαγωγές μείον τις εισαγωγές,Οι εξαγωγές μείον τις εισαγωγές κεφαλαιουχικών αγαθών,2,Οικονομικές Επιστήμες
