#,question,a,b,c,d,correct_answer,category
30,"Σύμφωνα με τον ν. 4940/2022, σε ποια περίπτωση ο/η αξιολογητής/τρια ΔΕΝ συντάσσει Σχέδιο Ανάπτυξης για τον/την αξιολογούμενο/η υπάλληλο;",Όταν ο/η υπάλληλος έχει συμπληρώσει περισσότερα από τριάντα (30) έτη υπηρεσίας,Όταν το επίπεδο δεξιοτήτων του/της υπαλλήλου καθιστά εξαιρετικά δυσχερή την ανάληψη βελτιωτικών και αναπτυξιακών πρωτοβουλιών,Όταν ο/η υπάλληλος δεν συμμετέχει σε τουλάχιστον δύο (2) προγραμματισμένες συναντήσεις αξιολόγησης μέσα στο έτος,Όταν ο/η υπάλληλος το ζητήσει εγγράφως για προσωπικούς λόγους,1,Δημόσια Διοίκηση και Διαχείριση Ανθρώπινου Δυναμικού
31,Η Επιτροπή Εποπτείας Αξιολόγησης δημοσίων υπαλλήλων ΔΕΝ είναι αρμόδια για:,Την εξέταση των ενστάσεων των αξιολογούμενων,Τον έλεγχο και την έγκριση των εκθέσεων αξιολόγησης υπαλλήλων υψηλής απόδοσης,Την εξέταση των εισηγήσεων των καθ` ύλην αρμόδιων μονάδων της Γενικής Γραμματείας Ανθρώπινου Δυναμικού Δημοσίου Τομέα,Τον καθορισμό του Σχεδίου Ανάπτυξης των υπό αξιολόγηση υπαλλήλων,3,Δημόσια Διοίκηση και Διαχείριση Ανθρώπινου Δυναμικού
32,"Σύμφωνα με τον ν. 4940/2022, αρμοδιότητα του/της Συμβούλου Ανάπτυξης Ανθρώπινου Δυναμικού ΔΕΝ αποτελεί:",Η παροχή συμβουλών και υποστήριξης στους/στις υπαλλήλους για την ανάπτυξη των δεξιοτήτων τους,Η συμμετοχή στη διαδικασία αξιολόγησης των υπαλλήλων ως αξιολογητής/τρια,Η υποστήριξη της αρμόδιας μονάδας ανθρώπινου δυναμικού για την εφαρμογή του συστήματος αξιολόγησης,Η συλλογή στοιχείων για θέματα ανθρώπινου δυναμικού που σχετίζονται με το σύστημα αξιολόγησης,1,Δημόσια Διοίκηση και Διαχείριση Ανθρώπινου Δυναμικού
33,Ποιος/α ορίζεται αρμόδιος/α για τον συντονισμό των Συμβούλων Ανάπτυξης Ανθρώπινου Δυναμικού;,Η Γενική Γραμματεία Ανθρώπινου Δυναμικού Δημοσίου Τομέα,Ο/Η Υπουργός Εσωτερικών,Το Ανώτατο Συμβούλιο Επιλογής Προσωπικού (Α.Σ.Ε.Π.),Το Εθνικό Κέντρο Δημόσιας Διοίκησης και Αυτοδιοίκησης (Ε.Κ.Δ.Δ.Α.),0,Δημόσια Διοίκηση και Διαχείριση Ανθρώπινου Δυναμικού
34,"Σύμφωνα με τον ν. 4940/2022 ο οποίος αφορά στη στοχοθεσία των οργανικών μονάδων του δημοσίου τομέα, ποια από τις παρακάτω ΔΕΝ αποτελεί κατηγορία στόχων οργανικής μονάδας:",Οι παρεχόμενες υπηρεσίες της οργανικής μονάδας,Η εσωτερική οργάνωση και λειτουργία της οργανικής μονάδας,"Οι γνώσεις, δεξιότητες και ικανότητες των υπαλλήλων της οργανικής μονάδας",Η ικανοποίηση των υπαλλήλων από τη θέση εργασίας,3,Δημόσια Διοίκηση και Διαχείριση Ανθρώπινου Δυναμικού
35,Με τον ν. 5149/2024 συστήνεται η Επιτροπή Κινήτρων και Ανταμοιβής για:,Τον συντονισμό της εφαρμογής του συστήματος κινήτρων και ανταμοιβής,Την κατανομή των μισθολογικών αυξήσεων στους/στις δημοσίους υπαλλήλους,Τον ορισμό του ανώτατου ορίου ετήσιας ανταμοιβής που μπορεί να καταβληθεί στους/στις δημοσίους υπαλλήλους,Τον ορισμό των δικαιούχων φορέων της ετήσιας ανταμοιβής,0,Δημόσια Διοίκηση και Διαχείριση Ανθρώπινου Δυναμικού
36,Αρμόδιο για την επιλογή Προϊσταμένων Γενικών Διευθύνσεων των Υπουργείων είναι:,Το Ανώτατο Συμβούλιο Επιλογής Προσωπικού (Α.Σ.Ε.Π.),Το Ειδικό Συμβούλιο Επιλογής Προϊσταμένων (ΕΙ.Σ.Ε.Π.),Το Συμβούλιο Επιλογής Προϊσταμένων (Σ.Ε.Π.),Καμία από τις λοιπές απαντήσεις,1,Δημόσια Διοίκηση και Διαχείριση Ανθρώπινου Δυναμικού
37,Από το Ειδικό Συμβούλιο Επιλογής Προϊσταμένων (ΕΙ.Σ.Ε.Π.) επιλέγονται οι Προϊστάμενοι/ες:,Γενικών Διευθύνσεων των υπουργείων,Οργανικών μονάδων των υπουργείων και οι Συντονίστριες/ιστές Αποκεντρωμένων Διοικήσεων,Γενικών Διευθύνσεων των υπουργείων και οι Υπηρεσιακές/οί Γραμματείς,Οργανικών μονάδων των υπουργείων,0,Δημόσια Διοίκηση και Διαχείριση Ανθρώπινου Δυναμικού
38,"Σύμφωνα με τον Κώδικα Ηθικής και Επαγγελματικής Συμπεριφοράς Υπαλλήλων του Δημόσιου Τομέα, οι αξίες που συμβάλλουν στην προώθηση της ακεραιότητας στο δημόσιο τομέα είναι:","Διαφάνεια, λογοδοσία, ευγένεια, αποφυγή διακρίσεων και δικαιοσύνη","Αντικειμενικότητα, αποφυγή διακρίσεων, εμπιστευτικότητα και ευγένεια","Αμεροληψία, ευγένεια, ακεραιότητα, εμπιστευτικότητα και δικαιοσύνη","Λογοδοσία, αμεροληψία, αντικειμενικότητα, εμπιστευτικότητα και διαφάνεια",3,Δημόσια Διοίκηση και Διαχείριση Ανθρώπινου Δυναμικού
39,Ο Οδηγός Ορθής Διοικητικής Συμπεριφοράς :,Προσδιορίζει το κλίμα που πρέπει να επικρατεί στη δημόσια υπηρεσία και διατυπώνει σαφείς κανόνες συμπεριφοράς για τους/τις δημόσιους/ες υπαλλήλους,Είναι αποτέλεσμα συνεργασίας του Υπουργείου Εσωτερικών και της Εθνικής Αρχής Διαφάνειας κατόπιν διαβούλευσης με τον Συνήγορο του Πολίτη,"Είναι αποτέλεσμα συνεργασίας του Υπουργείου Εσωτερικών, του Ανώτατου Συμβουλίου Επιλογής Προσωπικού (Α.Σ.Ε.Π.) και της Εθνικής Αρχής Διαφάνειας",Δεν υπάρχει Οδηγός Ορθής Διοικητικής Συμπεριφοράς,0,Δημόσια Διοίκηση και Διαχείριση Ανθρώπινου Δυναμικού
40,"Σύμφωνα με τον ν. 5013/2023, Συντονιστής του Εθνικού Συστήματος Πολυεπίπεδης Διακυβέρνησης είναι:",Ο/Η Πρωθυπουργός,Ο/Η Υπουργός Εσωτερικών,Ο/Η Γενικός/η Γραμματέας Ανθρώπινου Δυναμικού Δημόσιου Τομέα του Υπουργείου Εσωτερικών,Ο/Η Πρόεδρος του Εθνικού Συμβουλίου Πολυεπίπεδης Διακυβέρνησης,1,Δημόσια Διοίκηση και Διαχείριση Ανθρώπινου Δυναμικού
41,Τα όργανα διαχείρισης κινδύνων ΔΕΝ:,Εισηγούνται την πολιτική διαχείρισης κινδύνων στον/στην επικεφαλής του φορέα,"Αναπτύσσουν, παρακολουθούν και επικαιροποιούν το πλαίσιο διαχείρισης κινδύνων του φορέα",Ενημερώνουν και καθοδηγούν το προσωπικό του φορέα σχετικά με τον τρόπο εντοπισμού και αντιμετώπισης των κινδύνων,Υποβάλλουν μηνιαία έκθεση προς τον/την επικεφαλής του φορέα την οποία κοινοποιούν στην Εθνική Αρχή Διαφάνειας Ενότητα: Πληροφορική και Ψηφιακή Διακυβέρνηση,3,Δημόσια Διοίκηση και Διαχείριση Ανθρώπινου Δυναμικού
1,Τι είναι η RAM;,Μνήμη Τυχαίας Προσπέλασης,Μόνιμη Αποθήκευση,Επεξεργαστής Γραφικών,Μονάδα Εξόδου,0,Πληροφορική και Ψηφιακή Διακυβέρνηση
2,Ποιο χαρακτηριστικό διαχωρίζει τη μνήμη RAM από τον σκληρό δίσκο (HDD);,"Η RAM αποθηκεύει δεδομένα μόνιμα, ενώ ο HDD προσωρινά",Η RAM χάνει τα δεδομένα όταν ο υπολογιστής κλείνει,Η RAM έχει μεγαλύτερη χωρητικότητα από τον HDD,Η RAM χρησιμοποιείται μόνο για αποθήκευση εικόνων,1,Πληροφορική και Ψηφιακή Διακυβέρνηση
3,Ποιο από τα παρακάτω δεν αποτελεί μέρος μιας σύγχρονης CPU;,Μητρική πλακέτα,Κρυφή μνήμη (Cache),Πυρήνες επεξεργασίας (Cores),Μονάδα κινητής υποδιαστολής (FPU),0,Πληροφορική και Ψηφιακή Διακυβέρνηση
4,Ποιο από τα παρακάτω αποτελεί πλεονέκτημα της αποθήκευσης στο Cloud;,Πρόσβαση στα δεδομένα από οποιαδήποτε συσκευή με σύνδεση στο διαδίκτυο,Μηδενική κατανάλωση ενέργειας από τον/την χρήστη/τρια,Εγγυημένη προστασία από κάθε απώλεια δεδομένων,Αποθήκευση μόνο για εφαρμογές γραφείου,0,Πληροφορική και Ψηφιακή Διακυβέρνηση
5,Ποια είναι η κύρια χρήση της μνήμης ROM σε έναν υπολογιστή;,Εκτέλεση εφαρμογών,Αποθήκευση του λειτουργικού συστήματος,Διατήρηση βασικών εντολών για την εκκίνηση του υπολογιστή,Δυναμική διαχείριση δεδομένων κατά την εκτέλεση προγραμμάτων,2,Πληροφορική και Ψηφιακή Διακυβέρνηση
6,"Τι είναι ένας ""thin client"";",Ένας ελαφρύς φορητός υπολογιστής,Ένας υπολογιστής που βασίζεται σε έναν κεντρικό server για την επεξεργασία δεδομένων,Ένα πρόγραμμα επεξεργασίας κειμένου,Μια νέα γενιά καρτών γραφικών,1,Πληροφορική και Ψηφιακή Διακυβέρνηση
7,Ποια από τις παρακάτω τεχνολογίες χρησιμοποιείται για την επικοινωνία μεταξύ CPU και GPU;,USB 3.0,SATA III,PCI Express (PCIe),Bluetooth,2,Πληροφορική και Ψηφιακή Διακυβέρνηση
8,Ποια είναι η κύρια λειτουργία του BIOS ή UEFI σε έναν υπολογιστή;,Ελέγχει και διαχειρίζεται τη διαδικασία εκκίνησης του συστήματος,Παρέχει αποθηκευτικό χώρο για τον/την χρήστη/στρια,Αυξάνει την ταχύτητα του επεξεργαστή,Επιταχύνει τη λειτουργία της RAM,0,Πληροφορική και Ψηφιακή Διακυβέρνηση
9,Ποιο από τα παρακάτω ΔΕΝ είναι πρόγραμμα περιήγησης στο διαδίκτυο;,Mozilla Firefox,Google Chrome,Microsoft Edge,Adobe Acrobat,3,Πληροφορική και Ψηφιακή Διακυβέρνηση
10,Ποιο από τα παρακάτω ΔΕΝ είναι web browser:,Firefox,Safari,Word,Opera,2,Πληροφορική και Ψηφιακή Διακυβέρνηση
11,Ποιο λειτουργικό σύστημα είναι πιο δημοφιλές σε διακομιστές (servers);,Windows,MacOS,Linux,Android,2,Πληροφορική και Ψηφιακή Διακυβέρνηση
12,"Σύμφωνα με τη νομοθεσία για ψηφιακή διακυβέρνηση, η νομική ισχύς ηλεκτρονικών υπογραφών:",Δεν αναγνωρίζεται από το δημόσιο,Ισχύει μόνο για συμβάσεις με το κράτος,Είναι ισοδύναμη με την ιδιόχειρη υπογραφή,Είναι περιορισμένη σε εμπορικές συναλλαγές,2,Πληροφορική και Ψηφιακή Διακυβέρνηση
13,"Τα πρωτότυπα ηλεκτρονικά δημόσια έγγραφα, τα ηλεκτρονικά πιστοποιητικά και οι ηλεκτρονικές βεβαιώσεις:",Έχουν την ίδια νομική και αποδεικτική ισχύ με τα δημόσια έγγραφα που φέρουν ιδιόχειρη υπογραφή και σφραγίδα,Έχουν μικρότερη νομική και αποδεικτική ισχύ σε σχέση με τα δημόσια έγγραφα που φέρουν ιδιόχειρη υπογραφή και σφραγίδα,Εκδίδονται μόνο εφ’ όσον δεν είναι εφικτή η έκδοση δημοσίων εγγράφων που φέρουν ιδιόχειρη υπογραφή και σφραγίδα,Διακινούνται μόνο ηλεκτρονικά,0,Πληροφορική και Ψηφιακή Διακυβέρνηση
14,Η νομοθεσία για τη ψηφιακή διακυβέρνηση περιγράφει τις θυρίδες στην Ενιαία Ψηφιακή Πύλη ως:,Προσωπικούς λογαριασμούς για την αρχειοθέτηση εγγράφων πολιτών,Σύστημα διανομής ψηφιακών πληρωμών,Μέθοδο για την επεξεργασία αιτήσεων δημοσίων υπαλλήλων,Αποκλειστική πλατφόρμα για εμπορικές συναλλαγές,0,Πληροφορική και Ψηφιακή Διακυβέρνηση
15,Στη Γενική Γραμματεία Πληροφοριακών Συστημάτων & Ψηφιακής Διακυβέρνησης (Γ.Γ.Π.Σ. & Ψ.Δ.) τηρείται Μητρώο Διαλειτουργικότητας με σκοπό τη διαρκή καταγραφή και αποτύπωση των:,Μητρώων πολιτών και επιχειρήσεων,Υπηρεσιών κυβερνητικού νέφους δημόσιου τομέα (G-Cloud),Διαδικτυακών υπηρεσιών (web services) φορέων του δημοσίου τομέα,Ψηφιακών ή φυσικών διοικητικών διαδικασιών των φορέων του δημόσιου τομέα,2,Πληροφορική και Ψηφιακή Διακυβέρνηση
16,"Η διαλειτουργικότητα ενός Πληροφοριακού Συστήματος (ΠΣ) μέσω της οποίας επιτυγχάνεται η διασύνδεση συστημάτων και η ανταλλαγή δεδομένων, μπορεί να αναφέρεται μεταξύ:",του Πληροφοριακού Συστήματος (ΠΣ) και άλλων συστημάτων λογισμικού του οργανισμού,Υποσυστημάτων του Πληροφοριακού Συστήματος (ΠΣ),του Πληροφοριακού Συστήματος (ΠΣ) και άλλων τρίτων Πληροφοριακών Συστημάτων πιθανώς διαφορετικής πλατφόρμας υλοποίησης,Όλες οι λοιπές απαντήσεις,3,Πληροφορική και Ψηφιακή Διακυβέρνηση
17,Ποια είναι η διαφορά μεταξύ frontend και backend ανάπτυξης;,"Η frontend ανάπτυξη αφορά την εμφάνιση της εφαρμογής, ενώ η backend αφορά τη λογική της","Η backend ανάπτυξη αφορά την εμφάνιση της εφαρμογής, ενώ η frontend αφορά τη λογική της",Η frontend ανάπτυξη αφορά μόνο κινητές εφαρμογές,Η backend ανάπτυξη αφορά μόνο ιστοσελίδες,0,Πληροφορική και Ψηφιακή Διακυβέρνηση
18,Τι είναι το framework λογισμικού;,Ένα πακέτο λογισμικού που παρέχει βασική δομή για ανάπτυξη εφαρμογών,Υλικό του υπολογιστή,Ένα λειτουργικό σύστημα,Ένα εργαλείο για σχεδιασμό ιστοσελίδων,0,Πληροφορική και Ψηφιακή Διακυβέρνηση
19,Ποια από τα παρακάτω είναι «μεταβλητή» σε έναν υπολογιστή;,Ένα μαθηματικό σύμβολο,Ένα αποθηκευτικό μέσο στον υπολογιστή,Μια θέση στη μνήμη που αποθηκεύει μια τιμή,Ένας τύπος συνάρτησης,2,Πληροφορική και Ψηφιακή Διακυβέρνηση
20,Ποια γλώσσα χρησιμοποιείται για τη δημιουργία δυναμικών ιστοσελίδων στην πλευρά του διακομιστή (server-side);,HTML,CSS,PHP,XML,2,Πληροφορική και Ψηφιακή Διακυβέρνηση
21,Ποιο από τα παρακάτω είναι παράδειγμα IDE (Integrated Development Environment);,Windows,Visual Studio,Microsoft Word,Google Chrome,1,Πληροφορική και Ψηφιακή Διακυβέρνηση
22,Ποια είναι η διαφορά ανάμεσα σε έναν μεταγλωττιστή (compiler) και σε έναν διερμηνευτή (interpreter);,"Ο compiler μεταφράζει τον κώδικα γραμμή προς γραμμή, ενώ ο interpreter μεταφράζει όλο τον κώδικα ταυτόχρονα","Ο interpreter μεταφράζει τον κώδικα γραμμή προς γραμμή, ενώ ο compiler μεταφράζει όλο τον κώδικα ταυτόχρονα",Ο compiler χρησιμοποιείται μόνο για web εφαρμογές,O interpreter χρησιμοποιείται μόνο για mobile εφαρμογές,1,Πληροφορική και Ψηφιακή Διακυβέρνηση
23,Ποια γλώσσα προγραμματισμού χρησιμοποιείται κυρίως για web development;,JavaScript,Microsoft Excel,Adobe Photoshop,Windows Media Player,0,Πληροφορική και Ψηφιακή Διακυβέρνηση
24,Τι είναι η SQL;,Γλώσσα ερωτημάτων βάσεων δεδομένων,Τύπος υπολογιστή,Λειτουργικό σύστημα,Πρόγραμμα επεξεργασίας γραφικών,0,Πληροφορική και Ψηφιακή Διακυβέρνηση
25,Τι είναι το ERP;,Σύστημα Διαχείρισης Επιχειρησιακών Πόρων,Σύστημα Ηλεκτρονικού Ταχυδρομείου,Πρόγραμμα Επεξεργασίας Εικόνας,Βάση Δεδομένων,0,Πληροφορική και Ψηφιακή Διακυβέρνηση
26,Ποια είναι η βασική λειτουργία ενός συστήματος MIS;,Υποστήριξη λήψης αποφάσεων,Αναπαραγωγή πολυμέσων,Επεξεργασία κειμένου,Περιήγηση στο διαδίκτυο,0,Πληροφορική και Ψηφιακή Διακυβέρνηση
27,Τι είναι το primary key;,Μοναδικό αναγνωριστικό εγγραφής,Τύπος λειτουργικού συστήματος,Πρόγραμμα περιήγησης,Συσκευή εισόδου,0,Πληροφορική και Ψηφιακή Διακυβέρνηση
28,Σύμφωνα με τις διατάξεις του νόμου 4727/2020 τα δεδομένα υψηλής αξίας σύμφωνα με την Οδηγία (ΕΕ) 2019/1024:,Διατίθενται μόνο σε έντυπη μορφή και δεν είναι προσβάσιμα μέσω διαδικτυακών πλατφορμών,"Καθίστανται διαθέσιμα για περαιτέρω χρήση σε μηχαναγνώσιμη μορφή, μέσω κατάλληλων διεπαφών προγραμματισμού εφαρμογών (APIs) και, κατά περίπτωση, ως μαζική τηλεφόρτωση",Είναι διαθέσιμα μόνο σε περιορισμένο αριθμό χρηστών/χρηστριών και όχι στο ευρύ κοινό,Δημοσιεύονται μόνο σε μορφή που δεν είναι συμβατή με τα περισσότερα προγράμματα λογισμικού,1,Πληροφορική και Ψηφιακή Διακυβέρνηση
29,Ποια χαρακτηριστικά διακρίνουν τα μεγάλα δεδομένα (Big Data);,"Όγκος (Volume), Ταχύτητα (Velocity), Ποικιλία (Variety)","Ασφάλεια (Security), Αποθήκευση (Storage), Απόδοση (Performance)","Ευκολία χρήσης (Usability), Ακεραιότητα (Integrity), Δικτύωση (Networking)","Διαθεσιμότητα (Availability), Ποιότητα (Quality), Μηχανική Μάθηση (Machine Learning)",0,Πληροφορική και Ψηφιακή Διακυβέρνηση
30,Τι είναι ένας “κύβος δεδομένων” (data cube) στα συστήματα Σύγχρονης Αναλυτικής Επεξεργασίας ∆εδοµένων (Online Analytical Processing - OLAP);,Μια μέθοδος αποθήκευσης μη δομημένων δεδομένων σε βάσεις δεδομένων,Ένας πολυδιάστατος πίνακας δεδομένων που χρησιμοποιείται για ανάλυση,Ένα εργαλείο οπτικοποίησης για συναλλακτικά συστήματα,Ένα εξάρτημα υλικού που χρησιμοποιείται για την επεξεργασία OLAP ερωτημάτων,1,Πληροφορική και Ψηφιακή Διακυβέρνηση
31,Ποιος είναι ο κύριος ρόλος ενός Συστήματος Διαχείρισης Εφοδιαστικής Αλυσίδας (SCM - Supply Chain Management);,Ανάλυση δεδομένων πελατών για τη δημιουργία στοχευμένων διαφημίσεων,"Παρακολούθηση και διαχείριση της ροής προϊόντων, υπηρεσιών και πληροφοριών κατά μήκος της εφοδιαστικής αλυσίδας",Ανάπτυξη στρατηγικών μάρκετινγκ για την αύξηση των πωλήσεων,Διεξαγωγή ερευνών αγοράς για τη βελτίωση των επιχειρηματικών αποφάσεων,1,Πληροφορική και Ψηφιακή Διακυβέρνηση
