#,question,a,b,c,d,correct_answer,category
1,Η έννοια της απαγόρευσης των βασανιστηρίων (άρθρο 7 παρ. 2 Συντ.) περιλαμβάνει:,"Την απαγόρευση των βασανιστηρίων, της οποιασδήποτε σωματικής κάκωσης, της βλάβης υγείας, της άσκησης ψυχολογικής βίας και κάθε άλλης προσβολής της ανθρώπινης αξιοπρέπειας",Την απαγόρευση μόνο των βασανιστηρίων,Την απαγόρευση μόνο της οποιασδήποτε σωματικής κάκωσης,Πρόκειται για κατευθυντήρια διάταξη μη έχουσα νομικό-δεσμευτικό περιεχόμενο,0,Συνταγματικό Δίκαιο
2,Το άρθρο 4 παρ. 4 Συντ. σύμφωνα με το οποίο «μόνο Έλληνες πολίτες είναι δεκτοί σε όλες τις δημόσιες λειτουργίες εκτός από τις εξαιρέσεις που εισάγονται με ειδικούς νόμους»:,Αναθεωρείται,Δεν αναθεωρείται,Αναθεωρείται μερικώς,Συμπληρώνεται από το Ευρωπαϊκό Δίκαιο αν και δεν αναθεωρείται,3,Συνταγματικό Δίκαιο
3,Το δικαίωμα ίδρυσης και συμμετοχής σε πολιτικό κόμμα:,Είναι κοινωνικό δικαίωμα,Είναι πολιτικό δικαίωμα,Είναι ατομικό δικαίωμα,Είναι ατομικό και πολιτικό δικαίωμα συγχρόνως,1,Συνταγματικό Δίκαιο
4,Πώς νοείται ο όρος «κατοικία» στο άρθρο 9 Συντ. περί προστασίας του ασύλου της κατοικίας;,Μόνο η κατοικία που κατέχει κάποιος νόμιμα,Περιορίζεται σε ακίνητα των οποίων ο/η αιτών/ούσα είναι ιδιοκτήτης/τρια ή ενοικιαστής/στρια,Περιορίζεται σε ακίνητα των οποίων ο/η αιτών/ούσα είναι ιδιοκτήτης/τρια,"Περιλαμβάνει κάθε είδος χώρου, ανοικτού ή κλειστού, περιφραγμένου οικοπέδου ή αυλής, κινητού πράγματος, κυρίου και βοηθητικού υπό την προϋπόθεση ότι είναι περίκλειστος και η είσοδός του δεν είναι ελεύθερη",3,Συνταγματικό Δίκαιο
5,Το δικαίωμα δικαστικής προστασίας περιλαμβάνει:,Το δικαίωμα δωρεάν πρόσβασης σε δικαστήριο,Το δικαίωμα αποτελεσματικής δικαστικής προστασίας,Το δικαίωμα απευθείας προσβολής των αντισυνταγματικών νόμων στο Συμβούλιο της Επικρατείας,Καμία από τις λοιπές απαντήσεις,1,Συνταγματικό Δίκαιο
6,Είναι συνταγματική:,Η προηγούμενη διοικητική άδεια για την ίδρυση σωματείου,Η προηγούμενη διοικητική άδεια για τη διεξαγωγή συνάθροισης,Η κατάργηση του δημόσιου χαρακτήρα της εκπαίδευσης,Η υποχρέωση λήψης προηγούμενης άδειας για την άσκηση επαγγελματικής δραστηριότητας,3,Συνταγματικό Δίκαιο
7,Τα ατομικά (αμυντικά) δικαιώματα προϋποθέτουν:,Την αποχή του Κράτους,Την παροχή του Κράτους,Τη συλλογική δράση,Την επικράτηση της βούλησης της πλειοψηφίας,0,Συνταγματικό Δίκαιο
8,Το δικαίωμα στην ιδιωτική ζωή:,Αναγνωρίζεται κατ’ αρχήν και στα δημόσια πρόσωπα,Δεν εφαρμόζεται στο διαδίκτυο,Δεν μπορεί να περιοριστεί,Είναι μόνο νομοθετικά κατοχυρωμένο,0,Συνταγματικό Δίκαιο
9,Οι περιορισμοί των ατομικών δικαιωμάτων:,Επιβάλλονται από τον νόμο ή/και βάσει νόμου,Οδηγούν σε αναστολή τους,Είναι ελεύθεροι σε περίοδο πανδημίας,Δεν επιτρέπονται σε καμία περίπτωση,0,Συνταγματικό Δίκαιο
10,Τα ατομικά δικαιώματα αφορούν στην αξίωση των πολιτών:,Να μπορούν να επιλέξουν την αναρχία,Το κράτος να τους παρέχει την ελευθερία τους,Το κράτος να τους προστατεύει από εξωτερικούς και εσωτερικούς κινδύνους,"Το κράτος να μην προσβάλλει την ελευθερία τους να διαμορφώνουν ελεύθερα την προσωπικότητά τους, ως άτομα και ως μέλη της κοινωνίας",3,Συνταγματικό Δίκαιο
11,Η Ευρωπαϊκή Σύμβαση των Δικαιωμάτων του Ανθρώπου είναι:,Κατώτερη από τον τυπικό νόμο,Ουσιαστικός νόμος,Μέρος του ουσιαστικού Συντάγματος,Μη δεσμευτικό διεθνές κείμενο,2,Συνταγματικό Δίκαιο
12,Η αναδρομική ισχύς των νόμων:,Κατά κανόνα απαγορεύεται από το Σύνταγμα,Κατά κανόνα δεν απαγορεύεται από το Σύνταγμα,Είναι συνταγματικά επιβεβλημένη,Αφορά μόνο τους ουσιαστικούς νόμους,1,Συνταγματικό Δίκαιο
13,Η τριτενέργεια των δικαιωμάτων σημαίνει ότι:,"Τα δικαιώματα αντιτάσσονται και έναντι τρίτων, εκτός των μερών μιας σύμβασης",Τα δικαιώματα αντιτάσσονται και έναντι των ιδιωτών,Τα δικαιώματα ενεργοποιούνται με την πρόβλεψή τους σε τυπικό νόμο,Τα δικαιώματα εφαρμόζονται εάν δεν υφίσταται διάταξη τυπικού νόμου για το ίδιο ζήτημα,1,Συνταγματικό Δίκαιο
14,Η ελευθερία της τέχνης:,Είναι απόλυτη,Δεν υπόκειται σε όρια,Υπερισχύει των άλλων δικαιωμάτων,Μπορεί να περιοριστεί για λόγους προστασίας άλλων συνταγματικών δικαιωμάτων και εννόμων αγαθών,3,Συνταγματικό Δίκαιο
15,Οι δικαστικοί λειτουργοί μπορούν να εκφράζουν τις πεποιθήσεις τους υπέρ ή κατά πολιτικού κόμματος;,Απαγορεύεται απολύτως,Μόνο κατά την άσκηση των καθηκόντων τους,Μόνο εκτός της ώρας άσκησης των καθηκόντων τους,Μπορούν άνευ περιορισμού,0,Συνταγματικό Δίκαιο
16,Οι Έλληνες και οι Ελληνίδες έχουν δικαίωμα να συνέρχονται:,Ήσυχα και χωρίς όπλα,Μετά από άδεια της αστυνομίας,Εκτός των ωρών κοινής ησυχίας,"Όλες τις ημέρες της εβδομάδας, πλην της Κυριακής",0,Συνταγματικό Δίκαιο
17,Η επιβολή ιδιαίτερα έντονων κατασταλτικών μέτρων για τον περιορισμό μιας δημόσιας συγκέντρωσης σε ποια θεμελιώδη αρχή του συνταγματικού και του διοικητικού δικαίου είναι δυνατόν να προσκρούσει;,Στην αρχή της αναλογικότητας,Στην αρχή της υπεροχής και της προστασίας του δημοσίου συμφέροντος,Στην αρχή της χρηστής διοίκησης και της δικαιολογημένης εμπιστοσύνης του/της διοικούμενου/ης,Στην αρχή της διαφάνειας και της αποτελεσματικότητας της διοικητικής δράσης,0,Συνταγματικό Δίκαιο
18,Στα δικαιώματα συλλογικής δράσης συγκαταλέγεται:,Το δικαίωμα εργασίας,Το δικαίωμα του συνεταιρίζεσθαι,Το δικαίωμα αναφοράς προς τη Διοίκηση,Τ ο δικαίωμα έκφρασης γνώμης,1,Συνταγματικό Δίκαιο
19,Το πολίτευμα της Ελλάδας είναι:,Προεδρική Δημοκρατία,Προεδρευόμενη Κοινοβουλευτική Δημοκρατία,Βασιλευόμενη Κοινοβουλευτική Δημοκρατία,Προεδρική Κοινοβουλευτική Δημοκρατία,1,Συνταγματικό Δίκαιο
20,Ποια είναι η ευθύνη του/της βουλευτή για τα αυτόφωρα κακουργήματα;,Για τη δίωξή του απαιτείται ειδική άδεια,Δεν απαιτείται άδεια της Βουλής για τη δίωξή του/της,Δεν διώκεται καθόλου,Διώκεται μετά την λήξη της βουλευτικής του/της θητείας,1,Συνταγματικό Δίκαιο
21,O/Η Πρόεδρος της Δημοκρατίας μετά τις εκλογές διορίζει πρωθυπουργό:,Το πρόσωπο που υποδεικνύει ο/η απερχόμενος/η πρωθυπουργός,Τον/Την αρχηγό του πρώτου κόμματος,Τον/Την αρχηγό του κόμματος που έχει την απόλυτη πλειοψηφία των εδρών στη Βουλή,Το πρόσωπο που προτείνει η κοινοβουλευτική ομάδα του πρώτου κόμματος,2,Συνταγματικό Δίκαιο
22,Η Διοίκηση εντάσσεται στη(ν):,Νομοθετική εξουσία,Εκτελεστική εξουσία,Δικαστική εξουσία,Τέταρτη εξουσία,1,Συνταγματικό Δίκαιο
23,Το δημοψήφισμα προκηρύσσεται:,Με προεδρικό διάταγμα,Κάθε τέσσερα χρόνια,Για την εκλογή δημάρχων,Μόνο για τη συμμετοχή της χώρας σε διεθνείς οργανισμούς,0,Συνταγματικό Δίκαιο
24,Πρόωρη λήξη της βουλευτικής περιόδου λαμβάνει χώρα:,Σε περίπτωση πολέμου,Σε περίπτωση πανδημίας,Μετά από αίτημα της Κυβέρνησης προς τον/την Πρόεδρο της Δημοκρατίας για ανανέωση της λαϊκής εντολής ενόψει εθνικού θέματος εξαιρετικής σημασίας,Εάν ο/η Πρόεδρος της Δημοκρατίας διαπιστώσει ότι η Βουλή βρίσκεται σε δυσαρμονία με το λαϊκό αίσθημα,2,Συνταγματικό Δίκαιο
25,Τα συνταξιοδοτικά νομοσχέδια:,Είναι ειδικά,Είναι αναγκαία,Τροποποιούνται μόνο με πλειοψηφία 3/5 των μελών της Βουλής,Δεν μπορούν να τροποποιηθούν,0,Συνταγματικό Δίκαιο
26,Ποιος έχει δικαίωμα απονομής χάρης σε πολίτη;,O/Η Πρόεδρος της Δημοκρατίας ύστερα από πρόταση του/της Yπουργού Δικαιοσύνης και γνώμη συμβουλίου,Ο/Η Πρόεδρος της Βουλής ύστερα από εισήγηση της αρμόδιας κοινοβουλευτικής Επιτροπής,Ο/Η Πρωθυπουργός μετά από εισήγηση του Υπουργικού Συμβουλίου,Η Βουλή με την πλειοψηφία των μελών της,0,Συνταγματικό Δίκαιο
27,Τι ΔΕΝ μπορεί να αποφασιστεί με δημοψήφισμα;,Δημοσιονομικά ζητήματα,Κρίσιμα εθνικά θέματα,Κοινωνικά ζητήματα,Πολιτικά ζητήματα,0,Συνταγματικό Δίκαιο
28,Oι γενικά παραδεγμένοι κανόνες του διεθνούς δικαίου:,Υπερισχύουν έναντι κάθε άλλης αντίθετης διάταξης νόμου,Υπερισχύουν μόνο έναντι των ουσιαστικών νόμων,Υπερισχύουν μόνο έναντι των κανονιστικών πράξεων της διοίκησης,Υπερισχύουν μόνο έναντι των πράξεων νομοθετικού περιεχομένου,0,Συνταγματικό Δίκαιο
29,Βουλευτής που ψηφίζει αντίθετα προς την κοινοβουλευτική του/της ομάδα:,Οφείλει να παραιτηθεί,Χάνει την έδρα του/της,Καθίσταται αυτοδικαίως ανεξάρτητος/η βουλευτής,Καμία από τις λοιπές απαντήσεις,3,Συνταγματικό Δίκαιο
30,Η σύσταση εξεταστικής επιτροπής:,Απαιτεί απόφαση των 3/5 του όλου αριθμού των βουλευτών,Δεν μπορεί να αφορά ζητήματα άμυνας κι εξωτερικής πολιτικής,Συνιστά μορφή κοινοβουλευτικού ελέγχου,Ακολουθεί μετά την απόφαση ποινικής δίωξης υπουργού,2,Συνταγματικό Δίκαιο
31,Δικαίωμα εκλέγεσθαι στο αξίωμα του/της Προέδρου της Δημοκρατίας έχουν οι Έλληνες/ίδες πολίτες με:,Ικανότητα εκλέγειν άνω των 40 ετών,Ικανότητα εκλέγειν που είναι άνω των 40 ετών και έχουν ελληνική καταγωγή,Ικανότητα εκλέγειν,Ικανότητα εκλέγειν που είναι άνω των 25 ετών και έχουν ελληνική καταγωγή,1,Συνταγματικό Δίκαιο
32,Η διαδικασία για την εκλογή Προέδρου της Δημοκρατίας είναι:,Μυστική,Ονομαστική,Φανερή (με ανάταση της χειρός ή έγερση από τα βουλευτικά έδρανα),Ηλεκτρονική,1,Συνταγματικό Δίκαιο
33,Δεν υπόκειται σε προσυπογραφή υπουργού:,Η προκήρυξη δημοψηφίσματος,Η αναπομπή ψηφισμένου νομοσχεδίου,Η διάλυση της Βουλής για εθνικό θέμα εξαιρετικής σημασίας,Η αναστολή των εργασιών της τακτικής συνόδου της Βουλής,1,Συνταγματικό Δίκαιο
34,Οι συντακτικές πράξεις:,Έχουν αυξημένη τυπική ισχύ,Είναι παράνομες,Εκδίδονται από την αναθεωρητική Βουλή,Εκδίδονται βάσει εξουσιοδότησης απευθείας εκ του Συντάγματος,0,Συνταγματικό Δίκαιο
35,Το τυπικό Σύνταγμα είναι:,Αυστηρό,Γραπτό και αυστηρό,Οι διαδικαστικές διατάξεις του Συντάγματος,Το Σύνταγμα του 1975,1,Συνταγματικό Δίκαιο
36,Το Σύνταγμα προβλέπει:,Το επικυρωτικό συνταγματικό δημοψήφισμα,Το γνωμοδοτικό νομοθετικό δημοψήφισμα,Τη λαϊκή νομοθετική πρωτοβουλία,Καμία από τις λοιπές απαντήσεις,2,Συνταγματικό Δίκαιο
37,Η θητεία της Κυβέρνησης διαρκεί:,Τέσσερα χρόνια,Όσο διαρκεί η θητεία της Βουλής,Όσο την εμπιστεύεται η Βουλή,Μπορεί να διαρκέσει για δύο συνεχόμενες βουλευτικές περιόδους,2,Συνταγματικό Δίκαιο
38,Το ήπιο Σύνταγμα:,Δεν αναθεωρείται όπως η κοινή νομοθεσία,Είναι άγραφο,Είναι κατώτερο από το αυστηρό Σύνταγμα,Αναθεωρείται όπως η κοινή νομοθεσία,3,Συνταγματικό Δίκαιο
39,Οι Πράξεις Νομοθετικού περιεχομένου είναι:,Οργανικοί νόμοι,Ανώτερες από τον τυπικό νόμο,Ουσιαστικοί νόμοι,Ανώτερες από τις διεθνείς συμβάσεις,2,Συνταγματικό Δίκαιο
40,Η βουλευτική περίοδος:,Είναι πενταετής,Έχει την ίδια έναρξη με τη βουλευτική σύνοδο,Εμπεριέχει τη βουλευτική σύνοδο,Είναι εξαετής,2,Συνταγματικό Δίκαιο
41,Η Κυβέρνηση ζητά από τον/την Πρόεδρο της Δημοκρατίας τη διάλυση της Βουλής και την προκήρυξη εκλογών για να ανανεωθεί η λαϊκή εντολή και να αντιμετωπιστεί εθνικό θέμα εξαιρετικής σημασίας. Τις εκλογές θα διενεργήσει:,Οικουμενική Κυβέρνηση,Υπηρεσιακή Κυβέρνηση,Η ίδια Κυβέρνηση,Κυβέρνηση εθνικής ενότητας,2,Συνταγματικό Δίκαιο
42,Δεν είναι συνταγματική επιτρεπτή:,Η εκλογή βουλευτών με λίστα,Η ψήφος των εκτός επικρατείας εκλογέων,Η καθιέρωση της απλής αναλογικής,Η μείωση του όλου αριθμού των βουλευτών σε 150,3,Συνταγματικό Δίκαιο
43,Σύμφωνα με την ελεύθερη εντολή ο/η βουλευτής:,"Ανακαλείται, υπό προϋποθέσεις, από τους εκλογείς της περιφέρειάς του/της",Έχει ελευθερία γνώμης και ψήφου κατά συνείδηση,Δεν μπορεί να διαγραφεί από το κόμμα του/της,Δεν είναι ποτέ υπεύθυνος/η ποινικά,1,Συνταγματικό Δίκαιο
44,Η αναθεώρηση του Συντάγματος:,Εγκρίνεται με δημοψήφισμα,Γίνεται από μια Βουλή με αυξημένη πλειοψηφία,Είναι η μόνη δυνατότητα τυπικής αλλαγής του Συντάγματος,Είναι αρμοδιότητα του/της Προέδρου της Δημοκρατίας,2,Συνταγματικό Δίκαιο
45,Το ακαταδίωκτο των βουλευτών είναι:,Ατομικό δικαίωμα,Θεσμική εγγύηση,Κανόνας πολιτικής συμπεριφοράς,Απόλυτο,1,Συνταγματικό Δίκαιο
46,"Οι διατάξεις του ελληνικού Συντάγματος αναθεωρούνται, εκτός από εκείνες που καθορίζουν τη βάση και τη μορφή:",Της Βουλής,Του πολιτεύματος,Του εκλογικού σώματος,Της νομοθετικής διαδικασίας,1,Συνταγματικό Δίκαιο
47,Αρμόδιο όργανο για την άρση της βουλευτικής ασυλίας σε περίπτωση συκοφαντικής δυσφήμησης είναι:,Το Εφετείο,Η Βουλή,Ο/Η Πρόεδρος της Βουλής,Η κοινοβουλευτική ομάδα στην οποία ανήκει ο/η βουλευτής,1,Συνταγματικό Δίκαιο
48,Η αναθεωρητική λειτουργία μπορεί:,Να καταργήσει τον έλεγχο συνταγματικότητας των νόμων,Να περιορίσει τη θρησκευτική ελευθερία,Να καθιερώσει την αρμοδιότητα του/της Προέδρου της Δημοκρατίας να διορίζει την ηγεσία της δικαιοσύνης,Να μεταβάλει το πολίτευμα από Προεδρευόμενη σε ημι-προεδρική δημοκρατία,2,Συνταγματικό Δίκαιο
49,Η αντιπροσωπευτική αρχή:,Είναι συνώνυμο της έμμεσης δημοκρατίας σήμερα,Είναι συνώνυμο της άμεσης δημοκρατίας,Δεν είναι συνώνυμο ούτε της άμεσης ούτε της έμμεσης δημοκρατίας,Σημαίνει ότι οι βουλευτές δεσμεύονται από τη γνώμη των ψηφοφόρων της περιφέρειάς τους.,0,Συνταγματικό Δίκαιο
50,"Η θρησκευτική, κοσμοθεωρητική και πολιτική ουδετερότητα του Κράτους ως εγγύηση τήρησης της δημοκρατικής αρχής:",Αποτελεί υποχρέωση του Κράτους,Δεν αποτελεί υποχρέωση του Κράτους,Εναπόκειται στην διακριτική ευχέρεια του Κράτους,Προκύπτει από το Δίκαιο της Ευρωπαϊκής Ένωσης,0,Συνταγματικό Δίκαιο
51,Το Υπουργικό Συμβούλιο αποτελείται από την/τον Πρωθυπουργό και τις/τους Υπουργούς:,"Στους/Στις οποίους/ες περιλαμβάνονται και οι Αναπληρωτές/τριες Υπουργοί, όχι όμως και οι Υπουργοί Επικρατείας",Στους/Στις οποίους/ες περιλαμβάνονται οι Υπουργοί Επικρατείας και οι Αναπληρωτές/τριες Υπουργοί,Στους/Στις οποίους/ες περιλαμβάνονται οι Υπουργοί Επικρατείας και οι Αναπληρωτές/τριες Υπουργοί αλλά και οι Υφυπουργοί,"Στους/Στις οποίους/ες περιλαμβάνονται και οι Υπουργοί Επικρατείας, όχι όμως και οι Αναπληρωτές/τριες Υπουργοί",1,Συνταγματικό Δίκαιο
52,Ο/Η Πρόεδρος της Δημοκρατίας εκλέγεται:,Από τη Βουλή με πρόταση των κοινωνικών φορέων,Από τον Λαό με άμεση εκλογή,Από τη Βουλή με πρόταση των κοινοβουλευτικών ομάδων,Από τη Βουλή και τους/τις δημάρχους,2,Συνταγματικό Δίκαιο
53,Η αρχή της μονιμότητας των δημοσίων υπαλλήλων:,"Ταυτίζεται με την έννοια της ισοβιότητας, την οποία απολαμβάνουν οι δικαστικοί λειτουργοί","Διαφέρει από την έννοια της ισοβιότητας, την οποία απολαμβάνουν οι δικαστικοί λειτουργοί","Ορίζει ότι δεν παρέχεται η δυνατότητα απομάκρυνσης δημοσίου υπαλλήλου από την οργανική θέση στην οποία είναι διορισμένος/η, ακόμη και αν η θέση αυτή καταργηθεί με νόμο",Ισχύει για συγκεκριμένο χρονικό διάστημα,1,Συνταγματικό Δίκαιο
54,Οι δημόσιοι υπάλληλοι οφείλουν:,Πίστη στο Σύνταγμα και αφοσίωση στην πατρίδα,Πίστη στο Σύνταγμα και αφοσίωση στα εθνικά ιδεώδη,Να μη μετέχουν σε πολιτικά κόμματα και μη κυβερνητικές οργανώσεις,Να μη μετέχουν σε πολιτικά κόμματα,0,Συνταγματικό Δίκαιο
