#,question,a,b,c,d,correct_answer,category
37,Οι δικαστές και οι γενικοί εισαγγελείς του Δικαστηρίου της Ευρωπαϊκής Ένωσης διορίζονται:,"Από το Ευρωπαϊκό Συμβούλιο, μετά από διαβούλευση με επιτροπή που γνωμοδοτεί για την επάρκεια των υποψηφίων",Με κοινή συμφωνία των κυβερνήσεων των κρατών-μελών μετά από διαβούλευση με επιτροπή που γνωμοδοτεί για την επάρκεια των υποψηφίων,Από ειδική επιτροπή που αποφαίνεται για την επάρκεια των υποψηφίων,"Από το Συμβούλιο, μετά από διαβούλευση με το Ευρωπαϊκό Κοινοβούλιο και με επιτροπή που γνωμοδοτεί για την επάρκεια των υποψηφίων",1,Ευρωπαϊκοί Θεσμοί και Δίκαιο
38,Εάν εθνικό δικαστήριο θεωρεί ότι διάταξη κανονισμού της Ευρωπαϊκής Ένωσης παραβιάζει διάταξη του Χάρτη θεμελιωδών δικαιωμάτων της Ευρωπαϊκής Ένωσης υποχρεούται να:,Ακυρώσει τη διάταξη του κανονισμού,Αφήσει ανεφάρμοστη τη διάταξη του κανονισμού,Αποστείλει σχετικό προδικαστικό ερώτημα στο Δικαστήριο της Ευρωπαϊκής Ένωσης,Υποβάλει σχετική αναφορά στην Ευρωπαϊκή Επιτροπή,2,Ευρωπαϊκοί Θεσμοί και Δίκαιο
39,Ο Ευρωπαίος Διαμεσολαβητής επιλαμβάνεται περιπτώσεων κακής διοίκησης:,Εκ μέρους όλων των οργάνων της ΕΕ κατά την άσκηση των αρμοδιοτήτων τους,Εκ μέρους της Ευρωπαϊκής Επιτροπής κατά την άσκηση των αρμοδιοτήτων της,Εκ μέρους των εθνικών οργάνων κατά την εφαρμογή του δικαίου της ΕΕ,Εκ μέρους των διεθνών οργανισμών όπου είναι συμβαλλόμενο μέρος η ΕΕ,0,Ευρωπαϊκοί Θεσμοί και Δίκαιο
40,Το Ευρωπαϊκό Σύστημα Κεντρικών Τραπεζών (ΕΣΚΤ) συγκροτείται από:,Τις κεντρικές τράπεζες των κρατών-μελών,Τις κεντρικές τράπεζες των κρατών-μελών με νόμισμα το ευρώ,Την Ευρωπαϊκή Κεντρική Τράπεζα (ΕΚΤ) και τις κεντρικές τράπεζες των κρατών-μελών,Την Ευρωπαϊκή Κεντρική Τράπεζα (ΕΚΤ) και τις κεντρικές τράπεζες των κρατών-μελών με νόμισμα το ευρώ,2,Ευρωπαϊκοί Θεσμοί και Δίκαιο
41,Στη ζώνη του ευρώ ανήκουν:,Όλα τα κράτη μέλη της Ευρωπαϊκής Ένωσης,Τα κράτη μέλη που έως την 1η Ιανουαρίου 1999 συμμετείχαν στο Ευρωπαϊκό Νομισματικό Σύστημα,Όσα κράτη μέλη έχουν επιτύχει τα προβλεπόμενα από τη Συνθήκη για τη Λειτουργία της Ευρωπαϊκής Ένωσης (ΣΛΕΕ) κριτήρια σύγκλισης,"Όσα κράτη μέλη έχουν επιλέξει να συμμετάσχουν, αναλαμβάνοντας τις προβλεπόμενες από τη Συνθήκη για τη Λειτουργία της Ευρωπαϊκής Ένωσης (ΣΛΕΕ) δεσμεύσεις",2,Ευρωπαϊκοί Θεσμοί και Δίκαιο
42,Ποιος από τους παρακάτω αποκεντρωμένους οργανισμούς της Ευρωπαϊκής Ένωσης εδρεύει στην Ελλάδα;,Η Ευρωπαϊκή Αρχή Ασφαλίσεων και Επαγγελματικών Συντάξεων,Η Ευρωπαϊκή Αρχή Ελέγχου της Αλιείας,Ο Ευρωπαϊκός Οργανισμός για την Ασφάλεια στη Θάλασσα,Ο Οργανισμός της Ευρωπαϊκής Ένωσης για την Κυβερνοασφάλεια,3,Ευρωπαϊκοί Θεσμοί και Δίκαιο
43,Ποια από τις παρακάτω ΔΕΝ είναι αρμοδιότητα του Ευρωπαϊκού Οργανισμού Συνοριοφυλακής και Ακτοφυλακής;,Η διαχείριση των εξωτερικών συνόρων της Ευρωπαϊκής Ένωσης,Η αρχική ενημέρωση όσων ατόμων χρήζουν διεθνούς προστασίας ή επιθυμούν να υποβάλουν σχετική αίτηση,Η παροχή θεωρήσεων σε όσους πολίτες τρίτων χωρών επιθυμούν να εισέλθουν στην επικράτεια κράτους-μέλους,Η υποστήριξη των επιχειρήσεων έρευνας και διάσωσης ανθρώπων που κινδυνεύουν στη θάλασσα,2,Ευρωπαϊκοί Θεσμοί και Δίκαιο
44,"Σε περίπτωση παραβάσεως του ενωσιακού κανόνα από κράτος μέλος, ένα άλλο κράτος μέλος:",Δεν έχει νόμιμο τρόπο αντίδρασης,Δικαιούται μόνο να προσφύγει στο Δικαστήριο της Ευρωπαϊκής Ένωσης κατά του κράτους μέλους,Δικαιούται μόνο να προσφύγει στο Δικαστήριο της Ευρωπαϊκής Ένωσης κατά της Επιτροπής,Δικαιούται μόνο να μη συμμορφωθεί αυτό το ίδιο μέχρις ότου συμμορφωθεί το πρώτο,1,Ευρωπαϊκοί Θεσμοί και Δίκαιο
45,Πότε ένα όργανο της εθνικής διοίκησης δύναται να μην εφαρμόσει μία διάταξη ενός ενωσιακού Κανονισμού;,"Εάν έχει εκδώσει το Δικαστήριο της Ευρωπαϊκής Ένωσης απόφαση, με βάση την οποία η διάταξη παραβιάζει το πρωτογενές ενωσιακό δίκαιο",Εάν κρίνει ότι η διάταξη παραβιάζει το εθνικό Σύνταγμα,Εάν κρίνει ότι η διάταξη παραβιάζει το πρωτογενές ενωσιακό δίκαιο,Εάν επικαλεστεί ότι οι διοικήσεις άλλων τουλάχιστον έξι κρατών-μελών δεν εφαρμόζουν τη διάταξη με το σκεπτικό ότι παραβιάζει το πρωτογενές ενωσιακό δίκαιο,0,Ευρωπαϊκοί Θεσμοί και Δίκαιο
46,Τα κράτη μέλη υπέχουν ευθύνη αποζημίωσης στους ιδιώτες για παραβάσεις του δικαίου της Ευρωπαϊκής Ένωσης από πράξεις ή παραλείψεις:,Της εκτελεστικής εξουσίας,Της νομοθετικής εξουσίας,"Της νομοθετικής και της εκτελεστικής εξουσίας, όχι όμως και της δικαστικής",Οργάνων και των τριών εξουσιών,3,Ευρωπαϊκοί Θεσμοί και Δίκαιο
47,Οι νομοθετικές πράξεις της Ευρωπαϊκής Ένωσης:,Δημοσιεύονται στην Επίσημη Εφημερίδα της Ευρωπαϊκής Ένωσης και αρχίζουν να ισχύουν την εικοστή ημέρα από τη δημοσίευσή τους,"Δημοσιεύονται στην Επίσημη Εφημερίδα της Ευρωπαϊκής Ένωσης και αρχίζουν να ισχύουν από την ημερομηνία που ορίζουν ή, άλλως, από την εικοστή ημέρα από τη δημοσίευσή τους","Κοινοποιούνται στους αποδέκτες τους και παράγουν αποτελέσματα από την ημερομηνία που ορίζουν ή, άλλως, από την κοινοποίησή τους",Κοινοποιούνται στους αποδέκτες τους και παράγουν αποτελέσματα από την κοινοποίησή τους,1,Ευρωπαϊκοί Θεσμοί και Δίκαιο
48,Η αρχή της αναλογικότητας διέπει την άσκηση:,Όλων των αρμοδιοτήτων της Ευρωπαϊκής Ένωσης,Μόνο των συντρεχουσών αρμοδιοτήτων της Ευρωπαϊκής Ένωσης,Μόνο των αποκλειστικών αρμοδιοτήτων της Ευρωπαϊκής Ένωσης,Μόνο των συντονιστικών αρμοδιοτήτων της Ευρωπαϊκής Ένωσης,0,Ευρωπαϊκοί Θεσμοί και Δίκαιο
49,Η αρχή της επικουρικότητας ΔΕΝ αφορά:,Τον ρόλο των εθνικών κοινοβουλίων,Την άσκηση των αποκλειστικών αρμοδιοτήτων της Ευρωπαϊκής Ένωσης,Τον δικαστικό έλεγχο των νομικών πράξεων της Ευρωπαϊκής Ένωσης,Τη συνήθη νομοθετική διαδικασία,1,Ευρωπαϊκοί Θεσμοί και Δίκαιο
50,Η Συνθήκη της Λισαβόνας είχε ως στόχο:,Να διευκολύνει τη διεύρυνση της Ευρωπαϊκής Ένωσης με τις πρώην κομμουνιστικές χώρες της Ανατολικής Ευρώπης,"Να συμπεριλάβει μεγάλο μέρος των διατάξεων της Συνθήκης για τη θέσπιση Συντάγματος της Ευρώπης, της οποίας η κύρωση δεν κατέστη δυνατή",Να θεσπίσει το νομικό πλαίσιο της Οικονομικής και Νομισματικής Ένωσης,Να θεσπίσει το νομικό πλαίσιο της Κοινής Εξωτερικής Πολιτικής και Πολιτικής Ασφάλειας,1,Ευρωπαϊκοί Θεσμοί και Δίκαιο
51,Η προσχώρηση της Ευρωπαϊκής Ένωσης στην Ευρωπαϊκή Σύμβαση Δικαιωμάτων του Ανθρώπου (ΕΣΔΑ):,"Είναι δυνατή, αλλά δεν προβλέπεται ειδικώς στις ισχύουσες Συνθήκες",Προβλέπεται ρητά από τη Συνθήκη της Λισαβόνας υπό τον όρο ότι η προσχώρηση δεν μεταβάλλει τις αρμοδιότητες της Ευρωπαϊκής Ένωσης όπως ορίζονται στις Συνθήκες,Δεν είναι δυνατή δεδομένου ότι το Δικαστήριο της Ευρωπαϊκής Ένωσης έχει αποφανθεί ότι η Ευρωπαϊκή Ένωση δεν έχει αρμοδιότητα να  προσχωρήσει στην ΕΣΔΑ,"Δεν είναι δυνατή δεδομένου ότι η ΕΣΔΑ δεν επιτρέπει σε διεθνείς οργανισμούς, όπως η Ευρωπαϊκή Ένωση, να γίνουν συμβαλλόμενα μέρη",1,Ευρωπαϊκοί Θεσμοί και Δίκαιο
52,"Μετά τη θέση σε ισχύ της Συνθήκης της Λισαβόνας, από πού απορρέει η αρχή της υπεροχής του δικαίου της Ένωσης έναντι του ελληνικού δικαίου;","Από τη Συνθήκη για την Ευρωπαϊκή Ένωση και τη Συνθήκη για τη λειτουργία της Ευρωπαϊκής Ένωσης, όπου έχει προσαρτηθεί δήλωση η οποία παραπέμπει σε σχετική γνωμοδότηση της Νομικής Υπηρεσίας του Συμβουλίου",Από τη νομολογία του Δικαστηρίου της Ευρωπαϊκής Ένωσης περί της αυτονομίας και της ιδιαίτερης φύσης της έννομης τάξης της Ένωσης,Από το συνδυασμό των παρ. 2 και 3 του άρθρου 28 του ελληνικού Συντάγματος,Από το Πρωτόκολλο για τα προνόμια και τις ασυλίες της Ευρωπαϊκής Ένωσης,1,Ευρωπαϊκοί Θεσμοί και Δίκαιο
53,Ποια από τις ακόλουθες προτάσεις ΔΕΝ περιγράφει ορθά τη νομική φύση της Ευρωπαϊκής Ένωσης όπως αυτή προσδιορίστηκε από το Δικαστήριο της Ευρωπαϊκής Ένωσης:,"Με τις Συνθήκες τα κράτη μέλη μεταβίβασαν εξουσίες στην Κοινότητα/Ένωση και έτσι περιόρισαν, αν και σε ορισμένους μόνο τομείς, τα κυριαρχικά τους δικαιώματα","Οι Συνθήκες δεν δημιουργούν μόνο αμοιβαίες υποχρεώσεις μεταξύ των συμβαλλομένων κρατών, αλλά και δικαιώματα των πολιτών τους","Αντίθετα προς τις συνήθεις διεθνείς συνθήκες, η Συνθήκη ΕΟΚ δημιούργησε ιδιαίτερη έννομη τάξη, η οποία ενσωματώθηκε στα νομικά συστήματα των κρατών μελών","Με τις Συνθήκες τα κράτη μέλη μεταβίβασαν στην Κοινότητα/Ένωση συγκεκριμένες εξουσίες, των οποίων το εύρος μπορούν να κρίνουν τα εθνικά συνταγματικά ή ανώτατα δικαστήρια",3,Ευρωπαϊκοί Θεσμοί και Δίκαιο
54,Ποια από τις ακόλουθες προτάσεις ΔΕΝ είναι ορθή;,Η Ευρωπαϊκή Ένωση  δεν μπορεί να εκδίδει νομοθετικά μέτρα με αντικείμενο την εναρμόνιση των νομοθεσιών των κρατών μελών σε τομείς στους οποίους η Ευρωπαϊκή Ένωση διαθέτει μόνον υποστηρικτικές αρμοδιότητες,"Η Συνθήκη για την Λειτουργία της Ευρωπαϊκής Ένωσης (ΣΛΕΕ) περιέχει ρητή νομική βάση για την εναρμόνιση των εθνικών νομοθεσιών που αφορούν τους έμμεσους φόρους, όχι όμως και την άμεση φορολογία",Η Συνθήκη για την Λειτουργία της Ευρωπαϊκής Ένωσης (ΣΛΕΕ) επιτρέπει στα κράτη μέλη να συνάπτουν διεθνείς συμφωνίες με τρίτα κράτη σχετικά με το ύψος των δασμών που επιβάλλονται στις εκατέρωθεν εισαγωγές και τις εξαγωγές,Η Ευρωπαϊκή Ένωση μπορεί να εκδίδει οδηγίες για την εναρμόνιση των διατάξεων των κρατών μελών που αφορούν την ανάληψη και την άσκηση μη μισθωτών δραστηριοτήτων,2,Ευρωπαϊκοί Θεσμοί και Δίκαιο
55,Ποιος δύναται να υποβάλει σχέδια τροποποίησης της Συνθήκης για την Ευρωπαϊκή Ένωση και τη Συνθήκη για τη Λειτουργία της Ευρωπαϊκής Ένωσης κατά τη συνήθη διαδικασία αναθεώρησης;,Το Κοινοβούλιο κάθε κράτους-μέλους,Οι κυβερνήσεις τριών τουλάχιστον κρατών-μελών ή η Επιτροπή,"Η κυβέρνηση κάθε κράτους-μέλους, το Ευρωπαϊκό Κοινοβούλιο ή η Επιτροπή",Η κυβέρνηση κάθε κράτους-μέλους ή η Επιτροπή Ενότητα: Οικονομικές Επιστήμες,2,Ευρωπαϊκοί Θεσμοί και Δίκαιο
1,"Ας υποθέσουμε ότι βρίσκετε στο δρόμο ένα χαρτονόμισμα των 20 Ευρώ. Εάν επιλέξετε να το χρησιμοποιήσετε για να προμηθευτείτε ένα εισιτήριο και να πάτε στο θέατρο, το κόστος ευκαιρίας παρακολούθησης της παράστασης είναι:","Κανένα, διότι το χαρτονόμισμα των 20 Ευρώ το βρήκατε",20 ευρώ (διότι θα μπορούσατε να χρησιμοποιήσετε το 20 Ευρώ για κάτι άλλο),20 ευρώ (διότι θα μπορούσατε να χρησιμοποιήσετε το 20 Ευρώ για κάτι άλλο) ΣΥΝ την αξία του χρόνου που αντιστοιχεί στην παρακολούθηση της παράστασης,20 ευρώ (διότι θα μπορούσατε να χρησιμοποιήσετε το 20 Ευρώ για κάτι άλλο) ΜΕΙΟΝ την αξία του χρόνου που αντιστοιχεί στην παρακολούθηση της παράστασης,2,Οικονομικές Επιστήμες
2,Σε ποια περιοχή του υποδείγματος της καμπύλης παραγωγικών δυνατοτήτων θεωρείτε ότι οι συνδυασμοί αντιστοιχούν σε ανεργία;,Σε όλα τα σημεία που βρίσκονται επί της καμπύλης,Στα σημεία που βρίσκονται στην περιοχή άνω και δεξιά της καμπύλης,Στα σημεία που βρίσκονται εντός της περιοχής που ορίζεται από την καμπύλη,Καμία από τις λοιπές περιπτώσεις δεν είναι σωστή,2,Οικονομικές Επιστήμες
3,Ποια από τις παρακάτω προτάσεις είναι σωστή αναφερόμενη στην Καμπύλη Παραγωγικών Δυνατοτήτων:,Τα σημεία επί της καμπύλης καταδεικνύουν τι και πόσο θα παραχθεί και πώς θα διανεμηθεί ο εκάστοτε παραχθείς συνδυασμός προϊόντων,Τα σημεία άνω και δεξιά της καμπύλης καταδεικνύουν παραγωγικά εφικτούς και αποδοτικούς συνδυασμούς προϊόντων,"Τα σημεία εντός της περιοχής που προσδιορίζεται από την καμπύλη, καταδεικνύουν εφικτούς μεν αλλά μη αποδοτικούς  συνδυασμούς προϊόντων",Καμία από τις λοιπές προτάσεις δεν είναι σωστή,2,Οικονομικές Επιστήμες
4,Με ποιόν από τους παρακάτω τρόπους απεικονίζεται η Καμπύλη Παραγωγικών Δυνατοτήτων στην περίπτωση αυξανόμενου κόστους ευκαιρίας;,Με καμπύλη γραμμικής μορφής αρνητικής κλίσης,Με καμπύλη κοίλη προς την αρχή των αξόνων,Με καμπύλη κυρτή προς τη γραμμή των αξόνων,Με καμπύλη γραμμικής μορφής θετικής κλίσης,1,Οικονομικές Επιστήμες
5,Μία μετατόπιση της καμπύλης παραγωγικών δυνατοτήτων μίας οικονομίας μπορεί να προκληθεί από:,Πληθωρισμό,Αλλαγή στην παραγωγικότητα των συντελεστών παραγωγής,Αλλαγή στον συνδυασμό των ποσοτήτων των παραγόμενων προϊόντων,Μεταβολή στις καταναλωτικές προτιμήσεις,1,Οικονομικές Επιστήμες
6,Με ποιόν από τους παρακάτω τρόπους απεικονίζεται η Καμπύλη Παραγωγικών Δυνατοτήτων στην περίπτωση σταθερού κόστους ευκαιρίας;,Με καμπύλη γραμμικής μορφής αρνητικής κλίσης,Με καμπύλη κοίλη προς την αρχή των αξόνων,Με καμπύλη κυρτή προς τη γραμμή των αξόνων,Με καμπύλη γραμμικής μορφής θετικής κλίσης,0,Οικονομικές Επιστήμες
7,Ποια από τις ακόλουθες προτάσεις είναι αληθής σχετικά με την επίδραση της εισροής οικονομικών μεταναστών από το εξωτερικό στην καμπύλη παραγωγικών δυνατοτήτων (ΚΠΔ) της οικονομίας υποδοχής;,Η ΚΠΔ της οικονομίας υποδοχής μετατοπίζεται προς τα κάτω και αριστερά,Η ΚΠΔ της οικονομίας υποδοχής μετατοπίζεται προς τα πάνω και δεξιά,Η ΚΠΔ της οικονομίας υποδοχής δεν επηρεάζεται,Καμία από τις λοιπές προτάσεις δεν είναι σωστή,1,Οικονομικές Επιστήμες
8,Η Οικονομία της Αγοράς αναφέρεται:,Στο οικονομικό σύστημα μέσω του οποίου η κατανομή των μέσων παραγωγής προσδιορίζεται μέσω της αλληλεπίδρασης των νοικοκυριών και των επιχειρήσεων,Στο οικονομικό σύστημα μέσω του οποίου η κατανομή των μέσων παραγωγής προσδιορίζεται από την εκάστοτε κυβέρνηση,Στο οικονομικό σύστημα μέσω του οποίου η κατανομή των μέσων παραγωγής προσδιορίζεται από την πλειοψηφία της Βουλής κατά την ψήφιση του Κρατικού Προϋπολογισμού,Στο οικονομικό σύστημα μέσω του οποίου η κατανομή των μέσων παραγωγής προσδιορίζεται μέσω δημοψηφίσματος,0,Οικονομικές Επιστήμες
9,"Το πρόβλημα του τι θα παραχθεί  σε μία σχεδιαζόμενη οικονομία, βρίσκει τη λύση του κυρίως:",Μέσω ενεργειών των καταναλωτών,Μέσω της ανάγκης μεγιστοποίησης του ατομικού συμφέροντος,Μέσω των δυνάμεων της αγοράς,Μέσω κατευθύνσεων του κράτους,3,Οικονομικές Επιστήμες
10,"Η ατομική καμπύλη ζήτησης μετατοπίζεται προς τα δεξιά, λόγω:",Μείωσης του εισοδήματος του καταναλωτή,Μείωσης του αριθμού των καταναλωτών,Αύξησης της τιμής του υποκατάστατου αγαθού,Αύξησης της τιμής του συμπληρωματικού αγαθού,2,Οικονομικές Επιστήμες
11,Μία αύξηση στην τιμή ενός αγαθού με  ανελαστική ζήτηση θα έχει ως αποτέλεσμα η συνολική δαπάνη των καταναλωτών για το αγαθό αυτό:,Να αυξηθεί,Να μειωθεί,Να παραμείνει αμετάβλητη,Να μηδενιστεί,0,Οικονομικές Επιστήμες
12,"Εάν μία ποσοστιαία αύξηση στην τιμή ενός αγαθού μειώνει κατά ένα μεγαλύτερο ποσοστό τη ζητούμενη ποσότητά του, τότε η ζήτηση για το αγαθό αυτό είναι:",Ανελαστική ως προς την τιμή,Ελαστική ως προς το εισόδημα,Ελαστική ως προς την τιμή,Μοναδιαίας ελαστικότητας ως προς την τιμή,2,Οικονομικές Επιστήμες
