#,question,a,b,c,d,correct_answer,category
1,Τα δεδομένα προσωπικού χαρακτήρα είναι:,Οι πληροφορίες για την οικογενειακή και ερωτική ζωή,Οι πληροφορίες υγείας,Τα ηλεκτρονικά δεδομένα,"Κάθε πληροφορία, η οποία δυνητικά ταυτοποιεί ένα φυσικό  πρόσωπο",3,Συνταγματικό Δίκαιο
2,Το άρθρο 4 παρ.1 Συντ. σύμφωνα με το οποίο «οι Έλληνες είναι ίσοι ενώπιον του νόμου»:,Αναθεωρείται,Δεν αναθεωρείται,Αναθεωρείται μερικώς,Είναι δυνατή η κατάργησή του,1,Συνταγματικό Δίκαιο
3,Το δικαίωμα επιλογής επαγγελματικής έδρας:,Αποτελεί έκφραση του δικαιώματος συμμετοχής στην οικονομική ζωή της Χώρας,Δεν αποτελεί έκφραση συμμετοχής στην οικονομική ζωή της Χώρας,Δεν αποτελεί δικαίωμα,Αποτελεί έκφραση του δικαιώματος εργασίας,0,Συνταγματικό Δίκαιο
4,Το άρ. 2 παρ. 1 Συντ. σύμφωνα με το οποίο «ο σεβασμός και η προστασία της αξίας του ανθρώπου αποτελούν πρωταρχική υποχρέωση της Πολιτείας»:,Υπόκειται σε αναθεώρηση,Δεν υπόκειται σε αναθεώρηση,Υπόκειται σε μερική αναθεώρηση,Δεν υπόκειται σε αναθεώρηση αλλά ανανοηματοδοτείται από την Ευρωπαϊκή Σύμβαση Δικαιωμάτων του Ανθρώπου,3,Συνταγματικό Δίκαιο
5,Τα κοινωνικά δικαιώματα προϋποθέτουν για να εκπληρωθούν:,Την παροχή του Κράτους,Την αποχή του Κράτους,Την αναθεώρηση του Συντάγματος,Τη συναίνεση Κυβέρνησης και αντιπολίτευσης,0,Συνταγματικό Δίκαιο
6,Το Σύνταγμα κατοχυρώνει:,Την απόλυτη επαγγελματική ελευθερία,Την απαγόρευση των ιδιωτικοποιήσεων,Την απόλυτη ελευθερία της έκφρασης,Την αρχή της αειφορίας,3,Συνταγματικό Δίκαιο
7,Η αρχή της ισότητας:,Απαγορεύει τα θετικά μέτρα διάκρισης,Απαγορεύει την επεκτατική ισότητα,Προϋποθέτει την όμοια ρύθμιση των όμοιων περιπτώσεων και την ανόμοια των ανόμοιων,Δεν εφαρμόζεται σε περιόδους έκτακτης ανάγκης,2,Συνταγματικό Δίκαιο
8,Η ελευθερία της συνάθροισης:,Υπάγεται σε προηγούμενο έλεγχο σκοπιμότητας από την εκτελεστική εξουσία,Είναι απεριόριστη,Είναι δικαίωμα συλλογικής δράσης,Είναι ανώτερη από την ελευθερία της συνένωσης,2,Συνταγματικό Δίκαιο
9,Το δικαίωμα στην κοινωνική ασφάλιση:,Απαγορεύει κάθε μείωση στις συντάξεις,Προϋποθέτει την κατοχύρωση δημόσιων οργανισμών ασφάλισης,"Δεν κατοχυρώνεται στο Σύνταγμα, αλλά μόνο στη νομοθεσία","Δεν κατοχυρώνεται στο Σύνταγμα, αλλά στη νομολογία",1,Συνταγματικό Δίκαιο
10,Η αρχή της ίσης ευκαιρίας συμμετοχής στις διαδικασίες πλήρωσης θέσεων στη δημόσια διοίκηση:,Δεν έρχεται σε αντίθεση με την αξιοκρατική αρχή,"Συνάδει με την αρχή της αντικειμενικότητας, αλλά εν τοις πράγμασι αναιρεί την αρχή της αξιοκρατίας","Συνάδει με την αρχή της κοινωνικής αλληλεγγύης, αλλά όχι με τις αρχές της διαφάνειας και της αξιοκρατίας","Συνάδει με τις αρχές της κοινωνικής αλληλεγγύης και της διαφάνειας, αλλά όχι με την αξιοκρατική αρχή",0,Συνταγματικό Δίκαιο
11,Ποιοι από τους παρακάτω ΔΕΝ είναι φορείς ατομικών δικαιωμάτων;,Τα ανήλικα άτομα,Οι τελούντες υπό δικαστική συμπαράσταση,Οι ανιθαγενείς,Καμία από τις λοιπές απαντήσεις,3,Συνταγματικό Δίκαιο
12,To Kράτος Δικαίου:,Είναι το Κράτος που έχει δίκαιο,Σέβεται τα θεμελιώδη δικαιώματα και τη διάκριση των εξουσιών,Είναι η βούληση της πλειοψηφίας,Δεν έχει συνταγματική κατοχύρωση,1,Συνταγματικό Δίκαιο
13,Η αρχή της χρηστής διοίκησης:,Δεν είναι δεσμευτική,Είναι κανόνας δεοντολογίας,Απορρέει από την αρχή του κράτους δικαίου,Ισχύει μόνο στο ευρωπαϊκό δίκαιο,2,Συνταγματικό Δίκαιο
14,Οι Έλληνες/ίδες έχουν το δικαίωμα να συστήνουν σωματεία:,Εφόσον αυτά υπηρετούν το δημόσιο συμφέρον,Εφόσον δεν μετέχουν και σε συνδικαλιστική οργάνωση,Μετά από διοικητική άδεια,Μετά από έλεγχο νομιμότητας του καταστατικού,3,Συνταγματικό Δίκαιο
15,Τι σημαίνει αρχή της καθολικής ψηφοφορίας;,Ότι ψηφίζουν όλοι οι πολίτες ανεξαιρέτως,Ότι ψηφίζουν όλοι/ες όσοι/ες πληρούν κάποια οικονομικά και μορφωτικά κριτήρια,"Ότι ψηφίζουν όλοι/ες όσοι/ες έχουν συμπληρώσει ένα κατώτατο όριο ηλικίας, δεν είναι ανίκανοι/ες για δικαιοπραξία και δεν έχουν καταδικαστεί αμετάκλητα για ορισμένο έγκλημα",Ότι η ψηφοφορία είναι υποχρεωτική για όλους/ες,1,Συνταγματικό Δίκαιο
16,Οι στρατιωτικοί μπορούν να εκφράζουν τις πεποιθήσεις τους υπέρ ή κατά πολιτικού κόμματος;,Απαγορεύεται απολύτως,Μόνο κατά την άσκηση των καθηκόντων τους,Μόνο εκτός της ώρας άσκησης των καθηκόντων τους,Μπορούν άνευ περιορισμού,0,Συνταγματικό Δίκαιο
17,Η θρησκευτική λατρεία μπορεί να περιοριστεί:,Για λόγους δημοσίας αιδούς,Για λόγους δημόσιας τάξης και χρηστών ηθών,Για λόγους δημοσίου συμφέροντος,Καμία από τις λοιπές απαντήσεις,1,Συνταγματικό Δίκαιο
18,Από ποια κατηγορία δικαιωμάτων ΔΕΝ προκύπτουν (καταρχήν) αγώγιμες αξιώσεις των φορέων τους απέναντι στο κράτος;,Τα ατομικά,Τα κοινωνικά,Τα πολιτικά,Τα δικαιώματα που προβλέπονται από το φυσικό δίκαιο,1,Συνταγματικό Δίκαιο
19,Η αρχή της αναλογικότητας:,Προβλέπεται στο Σύνταγμα,"Δεν προβλέπεται στο Σύνταγμα, αλλά συνάγεται από τη νομολογία",Ταυτίζεται με την αρχή της δικαιολογημένης εμπιστοσύνης,Ταυτίζεται με την αρχή του κράτους δικαίου,0,Συνταγματικό Δίκαιο
20,Ποια είναι η ευθύνη του/της Προέδρου της Δημοκρατίας κατά τη διάρκεια της θητείας του/της;,"Μόνο για έσχατη προδοσία ή παραβίαση, με πρόθεση, του Συντάγματος",Για όλες τις πράξεις που έχει ενεργήσει κατά την άσκηση των καθηκόντων του/της,Για πράξεις που δεν σχετίζονται με την άσκηση των καθηκόντων,Ίδια με την ευθύνη του/της Πρωθυπουργού και των Υπουργών,0,Συνταγματικό Δίκαιο
21,Πόσο διαρκεί η βουλευτική περίοδος;,Πέντε (5) χρόνια,Τέσσερα (4) χρόνια,Έξι (6) χρόνια,Τρία (3) χρόνια,1,Συνταγματικό Δίκαιο
22,Το Σύνταγμά μας προβλέπει ρητά:,Την αρμοδιότητα των κεντρικών οργάνων του κράτους για την επιβολή πειθαρχικών ποινών στους/στις αιρετούς/ές της τοπικής αυτοδιοίκησης,Την εγκατάσταση και λειτουργία αποκεντρωμένων οργάνων του κράτους μόνο στις περιοχές όπου αυτό κρίνεται απαραίτητο,Τη γενική αποφασιστική αρμοδιότητα των περιφερειακών οργάνων του Κράτους για τις υποθέσεις της περιφέρειάς τους,Την πρόσθετη οικονομική ενίσχυση των ορεινών δήμων από τον κρατικό προϋπολογισμό,2,Συνταγματικό Δίκαιο
23,Το εκλογικό σύστημα είναι:,Ο μηχανισμός μετατροπής των ψήφων σε βουλευτικές έδρες,Η προεκλογική στρατηγική των κομμάτων,Ο τρόπος ανακήρυξης των βουλευτών,Το ψηφοδέλτιο κάθε κόμματος,0,Συνταγματικό Δίκαιο
24,"Μια Κυβέρνηση θεωρείται ότι έχει την εμπιστοσύνη της Βουλής, όταν:",Ψηφίζονται τα νομοσχέδια που προτείνει,Ψηφίζεται ο προϋπολογισμός,Στη διαδικασία ψήφου εμπιστοσύνης υπερψηφίζεται από την πλειοψηφία των παρόντων,Στη διαδικασία ψήφου εμπιστοσύνης υπερψηφίζεται από την απόλυτη πλειοψηφία των παρόντων βουλευτών που δεν πρέπει να είναι μικρότερη από 120 βουλευτές,3,Συνταγματικό Δίκαιο
25,Η Κυβέρνηση:,Διορίζει τους δημοσίους υπαλλήλους,Κατευθύνει τη γενική πολιτική της χώρας,Διορίζει τους δικαστές,Υποβάλλει ερωτήσεις στη Βουλή,1,Συνταγματικό Δίκαιο
26,Ποιος έχει δικαίωμα απονομής χάρης σε Υπουργό;,O/Η Πρόεδρος της Δημοκρατίας μόνο με τη συγκατάθεση της Bουλής,Ο/Η Πρόεδρος της Βουλής,Ο/Η Πρωθυπουργός,Η απόλυτη πλειοψηφία των μελών της Βουλής,0,Συνταγματικό Δίκαιο
27,Πώς γίνεται η νομοθέτηση σε περιόδους πολέμου;,Με δημοψήφισμα,Με πράξεις νομοθετικού περιεχομένου,Με την κανονική νομοπαραγωγική διαδικασία,Με υπουργικές αποφάσεις,1,Συνταγματικό Δίκαιο
28,"Σύμφωνα με την αρχή της διάκρισης των εξουσιών (άρθρο 26 Συντ.), η νομοθετική λειτουργία ασκείται:",Από τη Βουλή,Από τον/την Πρόεδρο της Δημοκρατίας,Από την Κυβέρνηση,Από τη Βουλή και τον/την Πρόεδρο της Δημοκρατίας,3,Συνταγματικό Δίκαιο
29,"Εάν παραιτηθεί ή πεθάνει, τον/την Πρόεδρο της Δημοκρατίας αναπληρώνει:",Ο/Η Πρωθυπουργός,Ο/Η Πρόεδρος της Βουλής,Ο/Η Πρόεδρος του Συμβουλίου της Επικρατείας,Ο/Η Αντιπρόεδρος της Κυβέρνησης,1,Συνταγματικό Δίκαιο
30,Οι σύνοδοι της Βουλής διακρίνονται σε:,"Τακτικές, έκτακτες και ειδικές","Μόνιμες, διαρκείς και ειδικές",Τακτικές και θερινές,Κανονικές και έκτακτες,0,Συνταγματικό Δίκαιο
31,"Εάν η Κυβέρνηση, μολονότι έχει την εμπιστοσύνη της απόλυτης πλειοψηφίας των βουλευτών, παραιτηθεί, ο/η Πρόεδρος της Δημοκρατίας:",Δίδει τη διερευνητική εντολή στον/στην αρχηγό του δεύτερου κόμματος,Προκηρύσσει εκλογές,Ζητά από την κοινοβουλευτική ομάδα της απερχόμενης Κυβέρνησης να υποδείξει νέο πρόσωπο για το αξίωμα του πρωθυπουργού,Καλεί τους/τις αρχηγούς των κομμάτων της Βουλής για να διερευνήσει εάν μπορεί να σχηματιστεί Κυβέρνηση που να απολαμβάνει την εμπιστοσύνη της Βουλής,3,Συνταγματικό Δίκαιο
32,Ο/Η Πρόεδρος της Δημοκρατίας εκλέγεται:,Από τον λαό,Από τη Βουλή με 180 ψήφους στην πρώτη ψηφοφορία,Από τη Βουλή με 151 ψήφους στη δεύτερη ψηφοφορία,Καμία από τις λοιπές απαντήσεις,3,Συνταγματικό Δίκαιο
33,Ο προεδρευόμενος χαρακτήρας του πολιτεύματος συνίσταται στο ότι:,Ο/Η Πρόεδρος της Δημοκρατίας δεν έχει πολιτική ευθύνη,Ο/Η Πρόεδρος της Δημοκρατίας δεν εκλέγεται από τον λαό,Ο/Η Πρόεδρος της Δημοκρατίας είναι αιρετός/ή και όχι κληρονομικός/ή,Το πολίτευμα είναι κοινοβουλευτικό,2,Συνταγματικό Δίκαιο
34,Τα κανονιστικά διατάγματα:,Εκδίδονται σε περιπτώσεις εξαιρετικά επείγουσας και απρόβλεπτης ανάγκης,Εκδίδονται μετά από εξουσιοδότηση νόμου για τεχνικά και λεπτομερειακά θέματα,Υπόκεινται σε προληπτικό έλεγχο νομιμότητας εκ μέρους του Συμβουλίου της Επικρατείας,Έχουν ισχύ για σαράντα μέρες από την έκδοσή τους,2,Συνταγματικό Δίκαιο
35,Για την αναθεώρηση του Συντάγματος απαιτείται:,Αυξημένη πλειοψηφία 180 ψήφων είτε στην προτείνουσα είτε στην αναθεωρητική Βουλή,Πρόταση αναθεώρησης που υπερψηφίζεται από 180 βουλευτές,Δημοψήφισμα,Πρωτοβουλία της Κυβέρνησης,0,Συνταγματικό Δίκαιο
36,Οι βουλευτές επικρατείας:,Εκλέγονται από τους Έλληνες και τις Ελληνίδες του εξωτερικού,Δεν δύνανται να ξεπερνούν τους 15,Εκλέγονται με σταυρό προτίμησης,Εκλέγονται με βάση τη δύναμη του πρώτου κόμματος στην επικράτεια,1,Συνταγματικό Δίκαιο
37,Το Σύνταγμα του 1975 έχει αναθεωρηθεί:,Τρεις φορές,Τέσσερις φορές,Πέντε φορές,Δύο φορές,1,Συνταγματικό Δίκαιο
38,Το Σύνταγμα:,Έχει υπέρτερη ισχύ από τον τυπικό νόμο,Έχει την ίδια ισχύ με τον τυπικό νόμο,Είναι κατώτερο από τον τυπικό νόμο,Έχει την ίδια ισχύ με το διεθνές δίκαιο,0,Συνταγματικό Δίκαιο
39,Οι συνθήκες του πολιτεύματος είναι:,Γραπτοί συνταγματικοί κανόνες που κατοχυρώθηκαν μετά από εθιμική τήρησή τους,Άγραφοι κανόνες λειτουργίας του πολιτεύματος,Διεθνείς συνθήκες που δεσμεύουν τα πολιτικά όργανα,Τυπικοί νόμοι,1,Συνταγματικό Δίκαιο
40,Οι βουλευτές:,Δεν έχουν ποινική ευθύνη,Δεν έχουν δικαίωμα παραίτησης,Εκλέγονται μόνο για δύο θητείες,Διατηρούν την έδρα τους σε περίπτωση διαγραφής τους από το κόμμα,3,Συνταγματικό Δίκαιο
41,Η διαδικασία για την εκλογή του/της Προέδρου της Δημοκρατίας:,"Αναστέλλεται, εφόσον δεν υπάρχει συναίνεση των κομμάτων","Αποσυνδέθηκε από τη διάλυση της Βουλής, με την αναθεώρηση του 2008",Περιλαμβάνει τη δυνατότητα 5 διαδοχικών ψηφοφοριών μέχρι την εκλογή,Ελέγχεται δικαστικά από το ΑΕΔ (Ανώτατο Ειδικό Δικαστήριο),2,Συνταγματικό Δίκαιο
42,Το Σύνταγμα:,Επιτρέπει να σχηματιστεί Κυβέρνηση μειοψηφίας,Απαγορεύει την Κυβέρνηση μειοψηφίας,"Απαγορεύει την παραίτηση της Κυβέρνησης, αν δεν υπάρχει λόγος εθνικής σημασίας",Δεν επιτρέπει τις Κυβερνήσεις συνεργασίας,0,Συνταγματικό Δίκαιο
43,Η κοινοβουλευτική αρχή σημαίνει ότι:,Ο/Η Πρόεδρος της Δημοκρατίας διορίζει την Κυβέρνηση,Ο/Η Πρωθυπουργός διορίζει την Κυβέρνηση,Η Κυβέρνηση εξαρτάται από την εμπιστοσύνη της Βουλής,Οι βουλευτές αντιπροσωπεύουν το έθνος,2,Συνταγματικό Δίκαιο
44,Η δημοκρατία στην Ελλάδα είναι:,Άμεση,Αντιπροσωπευτική,Προεδρική,Ημι-προεδρική,1,Συνταγματικό Δίκαιο
45,Η παραίτηση του/της Πρωθυπουργού επιφέρει σε κάθε περίπτωση:,Την παραίτηση της Κυβέρνησης,Τη διενέργεια εκλογών για την ανάδειξη νέας Κυβέρνησης,Τη διάλυση της Βουλής,Την αλλαγή ηγεσίας στο κόμμα του/της,0,Συνταγματικό Δίκαιο
46,Ο προληπτικός έλεγχος της συνταγματικότητας των νόμων ασκείται:,Από τα δικαστήρια,Από τη διοίκηση,Από τον/την Πρόεδρο της Βουλής,Από τη Βουλή και τον/την Πρόεδρο της Δημοκρατίας,3,Συνταγματικό Δίκαιο
47,To διεθνές δίκαιο είναι:,Ανώτερο από τον τυπικό νόμο,Κατώτερο από τον τυπικό νόμο,Ανώτερο από το Σύνταγμα,Ισόκυρο με το Σύνταγμα,0,Συνταγματικό Δίκαιο
48,Η αναστολή της ισχύος συνταγματικών δικαιωμάτων:,Προβλέπεται στο άρθρο 48 του Συντάγματος,Δεν είναι συνταγματικά επιτρεπτή,Εφαρμόστηκε στην πανδημία και την οικονομική κρίση,Είναι υπερσυνταγματικός κανόνας,0,Συνταγματικό Δίκαιο
49,Η διαπίστωση της ανάγκης αναθεώρησης του Συντάγματος αρχίζει με πρόταση:,Τουλάχιστον 50 βουλευτών,Της απόλυτης πλειοψηφίας του συνολικού αριθμού των βουλευτών,Της σχετικής πλειοψηφίας του συνολικού αριθμού των βουλευτών,Της ειδικής αυξημένης πλειοψηφίας των 3/5 του συνολικού αριθμού των βουλευτών,0,Συνταγματικό Δίκαιο
50,Κατά τη διάρκεια θρησκευτικής λατρευτικής πράξης εντός θρησκευτικού χώρου:,Επιτρέπεται η σύλληψη και η καταδίωξη προσώπου,Δεν επιτρέπεται η σύλληψη και η καταδίωξη προσώπου,Επιτρέπεται μόνο η σύλληψη,Επιτρέπεται μόνο η καταδίωξη,1,Συνταγματικό Δίκαιο
51,Μέλη της Κυβέρνησης με την ευρεία έννοια αποτελούν:,"Ο/Η Πρωθυπουργός, οι Υπουργοί, οι Υφυπουργοί και οι Βουλευτές του κυβερνώντος κόμματος","Ο/Η Πρόεδρος της Δημοκρατίας, ο/η Πρωθυπουργός, οι Υπουργοί και οι Υφυπουργοί",Το Υπουργικό Συμβούλιο και οι Υφυπουργοί,Ο/Η Πρωθυπουργός και το Υπουργικό Συμβούλιο,2,Συνταγματικό Δίκαιο
52,"Τον/Την Πρωθυπουργό αναπληρώνει, σε περίπτωση πρόσκαιρης απουσίας ή κωλύματός του/της:",Ο/Η Πρόεδρος της Βουλής,Ο/Η Υπουργός Εσωτερικών,Ο/Η πρώτος/η κατά τη σειρά τάξης Υπουργός,Ο/Η Πρόεδρος της Δημοκρατίας,2,Συνταγματικό Δίκαιο
53,Ο έλεγχος της συνταγματικότητας των νόμων:,Ασκείται μόνο εντός ενός έτους από την έναρξη ισχύος ενός νόμου,Ασκείται από τα δικαστήρια μόνο εφόσον προηγηθεί σχετικός ισχυρισμός του διαδίκου,Ασκείται από τα δικαστήρια μόνο αυτεπαγγέλτως,Ασκείται από τα δικαστήρια είτε αυτεπαγγέλτως είτε κατόπιν σχετικού ισχυρισμού του διαδίκου,3,Συνταγματικό Δίκαιο
54,Τα δικαστήρια μπορούν να ακυρώσουν:,Ατομικές και κανονιστικές πράξεις της διοίκησης,Μόνον τις ατομικές διοικητικές πράξεις,Τους αντισυνταγματικούς νόμους,Την προκήρυξη των εκλογών,0,Συνταγματικό Δίκαιο
55,Το Ανώτατο Ειδικό Δικαστήριο:,Ελέγχει την εσωτερική τυπική συνταγματικότητα των νόμων,Δικάζει τους υπουργούς,Ελέγχει τη νομιμότητα των πολιτικών κομμάτων,Δικάζει τις εκλογικές ενστάσεις,3,Συνταγματικό Δίκαιο
56,Οι δικαστές είναι:,Μόνιμοι/ες,Ισόβιοι/ες,Έχουν θητεία εννέα ετών που δύναται να ανανεωθεί μία φορά,Απαραβίαστοι,1,Συνταγματικό Δίκαιο
