#,question,a,b,c,d,correct_answer,category
26,H έκθεση αξιολόγησης του/της δημοσίου/ας υπαλλήλου περιλαμβάνει:,"Την υποχρεωτική επιλογή τριών (3) δεξιοτήτων προς ανάπτυξη και την ειδική αιτιολογία, όπου αυτή απαιτείται",Την υποχρεωτική επιλογή μίας (1) δεξιότητας προς ανάπτυξη και μίας (1) έως τριών (3) δυνατών δεξιοτήτων,"Την υποχρεωτική επιλογή μίας (1) έως τριών (3) δυνατών δεξιοτήτων και την ειδική αιτιολογία, όπου αυτή απαιτείται","Την υποχρεωτική επιλογή τριών (3) δεξιοτήτων προς ανάπτυξη και μίας (1) έως τριών (3) δυνατών δεξιοτήτων και την ειδική αιτιολογία, όπου αυτή απαιτείται",3,Δημόσια Διοίκηση και Διαχείριση Ανθρώπινου Δυναμικού
27,"Σύμφωνα με τον ν. 4940/2022, ποιον από τους παρακάτω σκοπούς εξυπηρετεί η συζήτηση αξιολόγησης μεταξύ αξιολογητή/τριας και αξιολογούμενου/ης δημοσίου/ας υπαλλήλου;",Την απλή ανακοίνωση του αποτελέσματος της γραπτής αξιολόγησης,Την αμφίδρομη επικοινωνία για την αποτίμηση της απόδοσης και τη διαμόρφωση του Σχεδίου Ανάπτυξης του/της αξιολογούμενου/ης,Την εξέταση ενστάσεων του/της αξιολογούμενου/ης σε περίπτωση διαφωνίας με την αρχική αξιολόγηση του/της Προϊσταμένου/ης του/της,"Την προαιρετική ανταλλαγή απόψεων μεταξύ αξιολογητή/τριας και αξιολογούμενου/ης, εφόσον το κρίνει σκόπιμο ο/η αξιολογητής/τρια",1,Δημόσια Διοίκηση και Διαχείριση Ανθρώπινου Δυναμικού
28,"Σύμφωνα με τον ν. 4940/2022, ποιοι/ες υπάλληλοι εξαιρούνται από το σύστημα αξιολόγησης;",Οι υπάλληλοι με σχέση ιδιωτικού δικαίου αορίστου χρόνου των Περιφερειών,Οι ιατροί και οδοντίατροι του κλάδου Δημόσιας Υγείας Ε.Σ.Υ.,Οι θρησκευτικοί λειτουργοί που επιβαρύνουν τον κρατικό προϋπολογισμό,Οι εκπαιδευτικοί της πρωτοβάθμιας και δευτεροβάθμιας εκπαίδευσης με απόσπαση σε διοικητικές υπηρεσίες,2,Δημόσια Διοίκηση και Διαχείριση Ανθρώπινου Δυναμικού
29,"Σύμφωνα με τον ν. 4940/2022, τι περιλαμβάνεται κατ’ ελάχιστο στην πλατφόρμα ηλεκτρονικής αξιολόγησης των δημοσίων υπαλλήλων;",Τα ονόματα των αξιολογητών/τριών,Οι ημερομηνίες διεξαγωγής των συζητήσεων αξιολόγησης,Τα στατιστικά δεδομένα αξιολόγησης,Οι λεπτομερείς περιγραφές των δεξιοτήτων των υπαλλήλων,1,Δημόσια Διοίκηση και Διαχείριση Ανθρώπινου Δυναμικού
30,"Σύμφωνα με τον ν. 4940/2022, αν ΔΕΝ επιτευχθεί συμφωνία μεταξύ αξιολογητή/τριας και αξιολογούμενου/ης κατά τη συζήτηση για την επικαιροποίηση του Σχεδίου Ανάπτυξης του υπαλλήλου:",Το θέμα παραπέμπεται στο Υπηρεσιακό Συμβούλιο,Ο/Η αξιολογητής/τρια αποφασίζει σχετικά,Ο/Η αξιολογούμενος/η έχει δικαίωμα υποβολής ένστασης,Το Σχέδιο Ανάπτυξης παραμένει σε ισχύ όπως είχε αρχικά συμφωνηθεί,1,Δημόσια Διοίκηση και Διαχείριση Ανθρώπινου Δυναμικού
31,Οι ενστάσεις για την αξιολόγηση ενώπιον της Επιτροπής Εποπτείας Αξιολόγησης ασκούνται:,Οποτεδήποτε επιθυμεί ο/η αξιολογούμενος/η,Μέσα σε αποκλειστική προθεσμία τριών (3) μηνών από τη γνωστοποίηση της αξιολόγησης,Μέσα σε αποκλειστική προθεσμία τριών (3) ετών από τη γνωστοποίηση της αξιολόγησης,Μέσα σε αποκλειστική προθεσμία δέκα (10) ημερών από τη γνωστοποίηση της αξιολόγησης,3,Δημόσια Διοίκηση και Διαχείριση Ανθρώπινου Δυναμικού
32,"Συμβουλευτική συνδρομή και υποστήριξη στο προσωπικό του υπουργείου, ιδίως αναφορικά με θέματα εφαρμογής του συστήματος αξιολόγησης, παρέχεται από την/τον:",Σύμβουλο Ακεραιότητας του οικείου φορέα,Σύμβουλο Ανάπτυξης Ανθρώπινου Δυναμικού του οικείου φορέα,Υπηρεσιακή/ό Γραμματέα του οικείου φορέα,Γενική/ό Γραμματέα Ανθρώπινου Δυναμικού Δημόσιου Τομέα του Υπουργείου Εσωτερικών,1,Δημόσια Διοίκηση και Διαχείριση Ανθρώπινου Δυναμικού
33,Ο χρόνος που διανύεται σε θέση Συμβούλου Ανάπτυξης Ανθρώπινου Δυναμικού λογίζεται ως χρόνος πραγματικής υπηρεσίας σε θέση:,Προϊσταμένου/ης επιπέδου Διεύθυνσης,Προϊσταμένου/ης επιπέδου Τμήματος,Προϊσταμένου/ης επιπέδου Γενικής Διεύθυνσης,Δεν λογίζεται ως χρόνος υπηρεσίας σε θέση Προϊσταμένου/ης,1,Δημόσια Διοίκηση και Διαχείριση Ανθρώπινου Δυναμικού
34,Ποιος είναι ο βασικός σκοπός της διαδικασίας στοχοθεσίας στις δημόσιες υπηρεσίες;,"Η τυπική καταγραφή των καθηκόντων κάθε υπαλλήλου, όπως αυτά περιγράφονται στο οργανόγραμμα του φορέα","Η ποσοτική μέτρηση της απόδοσης κάθε υπαλλήλου, με βάση συγκεκριμένους αριθμητικούς δείκτες","Ο καθορισμός σαφών, μετρήσιμων, εφικτών, σχετικών και χρονικά οριοθετημένων στόχων για κάθε οργανική μονάδα, σε συνάρτηση με το Σχέδιο Δράσης του φορέα",Η διασφάλιση της ομοιόμορφης κατανομής των εργασιών μεταξύ των υπαλλήλων κάθε οργανικής μονάδας,2,Δημόσια Διοίκηση και Διαχείριση Ανθρώπινου Δυναμικού
35,Ποιο είναι το ανώτατο όριο της ετήσιας ανταμοιβής που μπορεί να καταβληθεί σε δημόσιο/α υπάλληλο που δεν κατέχει θέση ευθύνης στο πλαίσιο του συστήματος κινήτρων και ανταμοιβής;,Το 10% του ετήσιου βασικού μισθού,Το 15% του ετήσιου βασικού μισθού,Το 20% του ετήσιου βασικού μισθού,Το 25% του ετήσιου βασικού μισθού,1,Δημόσια Διοίκηση και Διαχείριση Ανθρώπινου Δυναμικού
36,Οι φορείς του δημοσίου τομέα που θέλουν να πιστοποιηθούν για την ορθή και ολοκληρωμένη εφαρμογή του Κοινού Πλαισίου Αξιολόγησης (Κ.Π.Α.) καλούνται να υποβάλουν:,Έκθεση ανάλυσης κινδύνου για την εφαρμογή του Κ.Π.Α.,Έγγραφο έγκρισης του Κ.Π.Α. από το Υπουργείο Εσωτερικών,Ανάλυση των χρηματοοικονομικών στοιχείων τους,Μελέτη εφαρμογής του Κ.Π.Α και δήλωση πολιτικής ποιότητας,3,Δημόσια Διοίκηση και Διαχείριση Ανθρώπινου Δυναμικού
37,Ποια από τις παρακάτω προτάσεις σχετικά με το Συμβούλιο Επιλογής Προϊσταμένων (Σ.Ε.Π.) του Υπουργείου Εσωτερικών είναι ΛΑΘΟΣ;,Διενεργεί την δομημένη συνέντευξη για την επιλογή Προϊσταμένων Γενικής Διεύθυνσης,Είναι αρμόδιο για την επιλογή Προϊσταμένων Διεύθυνσης στους φορείς του δημοσίου τομέα,"Έχει πενταμελή σύνθεση, στην οποία μετέχουν δύο (2) μέλη του Ανώτατου Συμβουλίου Επιλογής Προσωπικού (Α.Σ.Ε.Π.)",Έχει τριετή θητεία,0,Δημόσια Διοίκηση και Διαχείριση Ανθρώπινου Δυναμικού
38,"Ο/Η δημόσιος/α υπάλληλος εξυπηρετεί τους πολίτες κατά το ωράριο που έχει επιλέξει και έχει ενημερώσει την υπηρεσία του, αφιερώνοντας εξολοκλήρου και αποκλειστικά τον χρόνο εργασίας του/της στα καθήκοντά του/της. Παραμένει και πέρα του ισχύοντος χρόνου εργασίας:",Εάν του/της ζητήσει συνάδελφός/ισσα του/της να τον/την βοηθήσει να ολοκληρώσουν κάποιες εκκρεμότητες,Προκειμένου να διευκολύνει τον/την Προϊστάμενο/η ο/η οποίος/α του/της ζήτησε να παραμείνει για να ολοκληρώσουν κάποιες εκκρεμότητες,Εφόσον έκτακτες και εξαιρετικές υπηρεσιακές ανάγκες το επιβάλλουν,Προκειμένου να ολοκληρώσει κάποιες εκκρεμότητες και επιθυμεί να πληρωθεί υπερωρίες,2,Δημόσια Διοίκηση και Διαχείριση Ανθρώπινου Δυναμικού
39,Καθ’ ύλην αρμόδιος φορέας για την παρακολούθηση και την προώθηση της εφαρμογής της αρχής της ίσης μεταχείρισης και των ίσων ευκαιριών είναι:,Ο/Η Σύμβουλος Ακεραιότητας της Δημόσιας Διοίκησης,Ο/Η Συνήγορος του Πολίτη,Η Γενική Γραμματεία Ισότητας και Ανθρωπίνων Δικαιωμάτων,Η Εθνική Αρχή Διαφάνειας,1,Δημόσια Διοίκηση και Διαχείριση Ανθρώπινου Δυναμικού
40,Το Εθνικό Σύστημα Πολυεπίπεδης Διακυβέρνησης εφαρμόζεται:,Στον στενό δημόσιο τομέα,Σε όλα τα νομικά πρόσωπα δημοσίου δικαίου,Σε όλα τα νομικά πρόσωπα δημοσίου και ιδιωτικού δικαίου του δημόσιου τομέα,Στον δημόσιο τομέα και σε όλα τα νομικά πρόσωπα ιδιωτικού δικαίου του δημόσιου τομέα,3,Δημόσια Διοίκηση και Διαχείριση Ανθρώπινου Δυναμικού
41,"Η διαβούλευση επί των νομοσχεδίων γίνεται και μέσω του δικτυακού τόπου www.opengov.gr και, κατά κανόνα,  διαρκεί:",Ένα (1) μήνα,Δύο (2) μήνες,Μία (1) εβδομάδα,Δύο (2) εβδομάδες Ενότητα:Πληροφορική και Ψηφιακή Διακυβέρνηση,3,Δημόσια Διοίκηση και Διαχείριση Ανθρώπινου Δυναμικού
1,Ποια από τις παρακάτω επιλογές περιγράφει τη λειτουργία της μνήμης RAM;,Μόνιμη αποθήκευση δεδομένων,Προσωρινή αποθήκευση δεδομένων που χρησιμοποιεί ο επεξεργαστής,Σύνδεση του υπολογιστή στο διαδίκτυο,Διαχείριση της ανάλυσης γραφικών,1,Πληροφορική και Ψηφιακή Διακυβέρνηση
2,Ποιο από τα παρακάτω μεγέθη εκφράζει τη συχνότητα λειτουργίας μιας CPU;,Bits,Gigabytes (GB),Gigahertz (GHz),Megapixels (MP),2,Πληροφορική και Ψηφιακή Διακυβέρνηση
3,Ποια είναι η κύρια διαφορά μεταξύ ενός σκληρού δίσκου (HDD) και ενός SSD;,Οι SSD είναι πιο αργοί από τους HDD,"Οι HDD χρησιμοποιούν κινούμενα μέρη, ενώ οι SSD όχι",Οι HDD καταναλώνουν λιγότερη ενέργεια από τους SSD,Οι SSD έχουν μεγαλύτερη χωρητικότητα από τους HDD,1,Πληροφορική και Ψηφιακή Διακυβέρνηση
4,"Ποια θύρα χρησιμοποιείται συνήθως για τη σύνδεση εξωτερικών συσκευών, όπως εκτυπωτές και εξωτερικοί δίσκοι;",HDMI,USB,Ethernet,VGA,1,Πληροφορική και Ψηφιακή Διακυβέρνηση
5,Ποιο από τα παρακάτω αποτελεί βασικό χαρακτηριστικό των υπερυπολογιστών (supercomputers);,Χρησιμοποιούνται για καθημερινές εργασίες γραφείου,Εκτελούν εξαιρετικά πολύπλοκους υπολογισμούς ταχύτατα,Είναι φθηνότεροι από τους επιτραπέζιους υπολογιστές,Λειτουργούν μόνο με ανανεώσιμες πηγές ενέργειας,1,Πληροφορική και Ψηφιακή Διακυβέρνηση
6,Σε ποιο επίπεδο μνήμης η CPU προσπελαύνει δεδομένα με τη μεγαλύτερη ταχύτητα;,Σκληρός Δίσκος (HDD),RAM,Κρυφή Μνήμη (Cache),USB Flash Drive,2,Πληροφορική και Ψηφιακή Διακυβέρνηση
7,Ποιο είναι το κύριο χαρακτηριστικό του λογισμικού ανοικτού κώδικα;,Είναι μη εκτελέσιμο σε Windows,Ο πηγαίος κώδικας είναι διαθέσιμος για τροποποίηση,Είναι πάντα δωρεάν,Δεν απαιτεί εγκατάσταση,1,Πληροφορική και Ψηφιακή Διακυβέρνηση
8,Ποιο από τα παρακάτω ΔΕΝ είναι διανομή Linux;,Ubuntu,Fedora,Safari,Debian,2,Πληροφορική και Ψηφιακή Διακυβέρνηση
9,"Ποιο λειτουργικό σύστημα είναι γνωστό για τη γραμμή εντολών (Terminal, CLI);",Windows,MacOS,Linux,Όλες οι λοιπές απαντήσεις,3,Πληροφορική και Ψηφιακή Διακυβέρνηση
10,Ποιο από τα παρακάτω είναι λειτουργικό σύστημα;,Microsoft Excel,Mozilla Firefox,Ubuntu,Adobe Photoshop,2,Πληροφορική και Ψηφιακή Διακυβέρνηση
11,"Σύμφωνα με τον νόμο 4727/2020 περί ψηφιακής διακυβέρνησης, ποιο ηλεκτρονικό δημόσιο έγγραφο από τα παρακάτω πρέπει να φέρει υποχρεωτικά τα στοιχεία του οργάνου που υπέγραψε το έγγραφο ως τελικός υπογράφων;",Το πρωτότυπο ηλεκτρονικό δημόσιο έγγραφο,Το ηλεκτρονικό ακριβές αντίγραφο,Το ψηφιοποιημένο ακριβές αντίγραφο,Καμία από τις λοιπές απαντήσεις,1,Πληροφορική και Ψηφιακή Διακυβέρνηση
12,Η νομοθεσία για τη ψηφιακή διακυβέρνηση αναφέρεται στην ηλεκτρονική διακίνηση εγγράφων μεταξύ δημοσίων φορέων ως:,Υποχρεωτική με χρήση πιστοποιημένων συστημάτων,Προαιρετική για φορείς με χαμηλό τεχνολογικό εξοπλισμό,Απαγορευμένη για διαβαθμισμένα δεδομένα,Δευτερεύουσα λειτουργία των πληροφοριακών συστημάτων,0,Πληροφορική και Ψηφιακή Διακυβέρνηση
13,Στο Ευρωπαϊκό Πλαίσιο Διαλειτουργικότητας (European Interoperability Framework - EIF) διακρίνουμε δομή με τα παρακάτω επίπεδα:,"Θεσμικό, Οργανωτικό, Σημασιολογικό, Τεχνικό","Θεσμικό, Οργανωτικό, Σημασιολογικό","Οργανωτικό, Σημασιολογικό, Τεχνικό","Θεσμικό, Οικονομικό, Σημασιολογικό, Τεχνικό",0,Πληροφορική και Ψηφιακή Διακυβέρνηση
14,Ποια είναι η κύρια ωφέλεια της αρχής «μόνον άπαξ»;,Μειώνει την ανάγκη για επαναλαμβανόμενη υποβολή πληροφοριών από τους πολίτες και τις επιχειρήσεις,Αυξάνει την πολυπλοκότητα των διαδικασιών του Δημοσίου,Ενθαρρύνει την επαναληπτική υποβολή δεδομένων για την ακρίβεια των πληροφοριών,Δημιουργεί επιπλέον βήματα στη διαδικασία υποβολής αιτήσεων,0,Πληροφορική και Ψηφιακή Διακυβέρνηση
15,Τι είναι ο αντικειμενοστρεφής προγραμματισμός;,Προγραμματισμός με τη χρήση γραφικών αντικειμένων,"Παράδειγμα προγραμματισμού που βασίζεται σε ""αντικείμενα"" που περιέχουν δεδομένα και κώδικα",Προγραμματισμός μόνο για κινητές συσκευές,Προγραμματισμός αποκλειστικά σε γλώσσα μηχανής,1,Πληροφορική και Ψηφιακή Διακυβέρνηση
16,Τι είναι μια συνάρτηση (function);,Μια μεταβλητή που αποθηκεύει ένα σύνολο δεδομένων,Ένα μπλοκ κώδικα που εκτελεί μια συγκεκριμένη εργασία,Ένα σχόλιο στον κώδικα,Μια εντολή για την εμφάνιση κειμένου στην οθόνη,1,Πληροφορική και Ψηφιακή Διακυβέρνηση
17,Ποια είναι η βασική αρχή του MVC στη σχεδίαση λογισμικού;,Model-Video-Control,Model-View-Controller,Multiple-Vector-Calculation,Memory-Virtual-Cache,1,Πληροφορική και Ψηφιακή Διακυβέρνηση
18,Ποια γλώσσα προγραμματισμού χρησιμοποιείται κυρίως για ανάπτυξη εφαρμογών iOS;,Java,Kotlin,Swift,C#,2,Πληροφορική και Ψηφιακή Διακυβέρνηση
19,Τι είναι το API;,Ένας τύπος προγραμματιστικού λάθους,Ένα λειτουργικό σύστημα,Διεπαφή Προγραμματισμού Εφαρμογών,Ένα πρόγραμμα ασφάλειας,2,Πληροφορική και Ψηφιακή Διακυβέρνηση
20,Τι είναι ο αλγόριθμος;,Σειρά βημάτων για την επίλυση ενός προβλήματος,Τύπος παράλληλου υπολογιστή,Πρόγραμμα συνεχούς αναπαραγωγής βίντεο,Μηχανισμός αποθήκευσης σύνθετων δεδομένων,0,Πληροφορική και Ψηφιακή Διακυβέρνηση
21,Ποιο από τα παρακάτω αποτελεί παράδειγμα ενός δημόσιου blockchain;,Το εσωτερικό σύστημα διαχείρισης της αλυσίδας εφοδιασμού μιας εταιρείας,Μια κεντρική βάση δεδομένων για τραπεζικές συναλλαγές,Ένα αποκεντρωμένο δίκτυο κρυπτονομισμάτων ανοιχτό σε όλους,Ένα ιδιωτικό κατανεμημένο καθολικό (distributed ledger) που χρησιμοποιείται στο πλαίσιο μιας κυβερνητικής υπηρεσίας,2,Πληροφορική και Ψηφιακή Διακυβέρνηση
22,Ποιο είναι το πιο διαδεδομένο σύστημα διαχείρισης βάσεων δεδομένων;,MySQL,Microsoft Word,Internet Explorer,Windows Media Player,0,Πληροφορική και Ψηφιακή Διακυβέρνηση
23,Ποιος είναι ο κύριος σκοπός ενός Συστήματος Ενδοεπιχειρησιακού Σχεδιασμού (Enterprise Resource Planning - ERP);,Διαχείριση και αυτοματοποίηση επιχειρησιακών διαδικασιών μέσω μιας ενοποιημένης πλατφόρμας,Ανάλυση δεδομένων πελατών και δημιουργία στοχευμένων διαφημίσεων,Διατήρηση ασφαλούς πρόσβασης στο εσωτερικό δίκτυο μιας επιχείρησης,Παροχή αποκλειστικά εργαλείων για τη διαχείριση ανθρώπινου δυναμικού,0,Πληροφορική και Ψηφιακή Διακυβέρνηση
24,Ποιο είναι το βασικό πλεονέκτημα των σχεσιακών βάσεων δεδομένων;,Ακεραιότητα δεδομένων,Γραφικό περιβάλλον,Ταχύτητα εκτύπωσης,Αναπαραγωγή πολυμεσικών δεδομένων,0,Πληροφορική και Ψηφιακή Διακυβέρνηση
25,Τι είναι το DBMS;,Σύστημα Διαχείρισης Βάσεων Δεδομένων,Πρόγραμμα επεξεργασίας κειμένου,Λογισμικό αναπαραγωγής πολυμεσικών δεδομένων,Συσκευή αποθήκευσης,0,Πληροφορική και Ψηφιακή Διακυβέρνηση
26,Ποιο είναι το όφελος των «ανοιχτών δεδομένων»;,"Αυξάνουν την ποιότητα, την αποδοτικότητα και τη διαφάνεια των δημόσιων υπηρεσιών",Οδηγούν σε εξοικονόμηση κόστους,Προσφέρουν μεγαλύτερη αποδοτικότητα στις διαδικασίες και την παροχή δημόσιων υπηρεσιών.,Όλες οι λοιπές απαντήσεις,3,Πληροφορική και Ψηφιακή Διακυβέρνηση
